year,source_document,section_bucket,subsection,proposal_title,lead_agency,supporting_agencies,commitment_type,quantified,metric_or_target,implementation_pathway,notes,commitment_id,lead_agency_standardized,supporting_agencies_standardized,item_type_clean,implementation_pathway_clean,binary_evaluable,binary_unit,overlap_theme,status_evidence_needed,source_quality,continuity_to_prior_year,matched_prior_commitment_id,matched_prior_title,match_basis,commitment_text,source_page,source_page_end,text_capture_confidence
2022,2022StateoftheStateBook.pdf,Housing / homelessness,"Part V-A: Launch A New, Comprehensive 5-Year Housing Plan",Pilot a Program to Create Affordable Homeownership Projects That Prioritize Resident Control and Permanent Affordability,Homes and Community Renewal,,program/governance,no,,mixed,First-pass coding from 2022 SOTS table of contents.,2022-132,HCR,,program/governance,executive_action,mixed,implemented,housing_general,agency report or official implementation evidence,first_pass_toc,,,,,"Affordable homeownership opportunities have become critically scarce, particularly in markets where home prices continue to skyrocket. At the same time, speculative investment in the real estate market, which has intensified in the single-family home sphere during the pandemic, continues to limit the availability of quality housing stock that is affordable to local residents in many markets across New York State. There is also a growing desire in communities across New York to take more control over their housing environments.

There are three primary goals of community-controlled housing: insulating housing from market forces, promoting equality and cohesion among neighbors, and enabling residents to exercise shared control over their housing. This pilot will solicit projects through a competitive Request for Proposals process and will allow for a variety of ownership models including, but not limited to: limited equity coops (Mitchell-Lama model), shared equity housing, and community land trusts.

All applications will need projects to be permanently affordable; to include a clear mechanism for residents of the housing project to be involved in the governance structure and long-term operation of the housing projects; and to be designed to serve to low-and-moderate income households in the community in which they are located. The intent of this pilot program is to expand the number of permanently

affordable, community-controlled units within New York State. A successful pilot program could lead to the creation of a large-scale program in the future, expanding affordable homeownership options for even more New Yorkers.",129,130,high
2022,2022StateoftheStateBook.pdf,Housing / homelessness,"Part V-A: Launch A New, Comprehensive 5-Year Housing Plan",Spur Innovation in Affordable Housing,Homes and Community Renewal,,other,no,,mixed,First-pass coding from 2022 SOTS table of contents.,2022-133,HCR,,other,mixed,no,,housing_general,agency report or official implementation evidence,first_pass_toc,,,,,"Housing production has tended to stick to tried-and-true models, without creatively reimagining approaches to construction technology when it can most make a difference. While intense market forces have squeezed many middle- and low- income New Yorkers out of the homeownership market, many communities still seek to gain more control over their housing stock. More globally, the speed at which any housing gets created - particularly affordable housing - continues to keep housing costs far higher than households can afford.

To address these growing challenges, Governor Hochul will initiate a pilot program for affordable housing innovation, supporting projects that take a dramatic new approach to construction in an effort to reduce costs. Innovative construction projects for the pilot could include approaches such as modular net-zero housing production, multi-family buildings using mass timber framing, and construction utilizing 3D printing, among others.",130,130,high
2022,2022StateoftheStateBook.pdf,Housing / homelessness,"Part V-A: Launch A New, Comprehensive 5-Year Housing Plan",Improve the Housing Stock of Rural Rental Properties,Homes and Community Renewal,,program/policy,no,,mixed,First-pass coding from 2022 SOTS table of contents.,2022-134,HCR,,program/policy,mixed,no,,housing_general,"implementation metrics, agency reports, or budget plus rollout evidence",first_pass_toc,,,,,"Governor Hochul's Housing Plan will provide funding through several programs that serve rural communities across the state. Programs will preserve and improve multifamily rental buildings; support farm worker housing; and preserve and invest in the manufactured and mobile home stock statewide (especially in rural areas), protecting valuable affordable housing for New York's rural residents.

Part V-B: Promote Housing Affordability by Expanding the Housing Supply

Housing costs continue to rise throughout the state, exacerbated by a dramatically inadequate housing supply, which leads to local and regional problems in affordable housing delivery. For example, since 2012, the New York City metro area has failed to build at least 150,000 units101 relative to job growth as compared to the rate in previous decades; in rural counties, more than 15,000 units102 were taken out of the housing stock over that time period. This shortage is largely the result of outdated laws, programs, and land use barriers that prevent the development of new housing.

To help reduce housing costs across the state, Governor Hochul will propose a set of legislative actions and targeted interventions that encourage development of housing supply in areas with high need and capacity, especially in areas near public transportation; that incentivize the creation of affordable rental housing in a cost- efficient way; and that allow for flexible conversions of existing commercial spaces into residential housing.

These proposals will make New York a more desirable and affordable place to live by expanding access to well-resourced areas and a more sustainable place to live - consistent with our Climate Act - by increasing density and access to transit.",130,131,high
2022,2022StateoftheStateBook.pdf,Housing / homelessness,Part V-B: Promote Housing Affordability by Expanding the Housing Supply,Encourage the Creation of Safe Accessory Dwelling Units,Homes and Community Renewal,,other,no,,mixed,First-pass coding from 2022 SOTS table of contents.,2022-135,HCR,,other,mixed,no,,housing_general,agency report or official implementation evidence,first_pass_toc,,,,,"Accessory Dwelling Units (ADUs) - which include backyard cottages, attics, garages, and basements - can provide an affordable multi-generational housing option that helps families live closer together. But current land use restrictions prevent homeowners in some communities from building ADUs. To permit these vital options and help reduce housing costs, Governor Hochul will propose legislation to require municipalities to allow a minimum of one ADU on owner- occupied residentially zoned lots.

This legislation would allow municipalities to set minimum and maximum size requirements that both meet safety standards but will not prevent reasonable new

construction. For example, municipalities cannot set minimum sizes too large and maximum sizes too small in order to limit implementation. In New York City, this legislation will require the creation of an amnesty program to legalize existing ADUs, with an expectation that they be brought into compliance with key building code requirements to ensure resident safety, but also provide some flexibility for the City to exempt some units from specific Multiple Dwelling Law (MDL) provisions without further New York State legislation.

Governor Hochul's Housing Plan described above includes capital funding for municipalities or non-profits to assist in the legalization or creation of new ADUs.",131,132,high
2022,2022StateoftheStateBook.pdf,Housing / homelessness,Part V-B: Promote Housing Affordability by Expanding the Housing Supply,Spur Transit-Oriented Development,Homes and Community Renewal,Department of Transportation; MTA,other,no,,mixed,First-pass coding from 2022 SOTS table of contents.,2022-136,HCR,DOT; MTA,other,mixed,no,,transit_oriented_housing,agency report or official implementation evidence,first_pass_toc,,,,,"There are roughly 120 municipalities103 across New York with access to commuter or long-distance rail stations connected to the Amtrak, Metro-North, or Long Island Rail Road (LIRR) transit systems. Some 3.2 million New Yorkers in those areas live within a half-mile of those stations, including roughly 1.4 million in New York City, 1 million in Long Island, 450,000 in Westchester County, 160,000 in the Hudson Valley, and 200,000 upstate.104

Encouraging development that allows even more people to live near these stops will create more climate-friendly communities and improve access to jobs, schools, and open spaces. But currently, at least 30 existing stations are surrounded by zoning that prohibits multi-family housing, with additional stations limiting development to smaller-scale housing despite being located in peak commuter zones that can sustain greater density.

To spur transit-oriented development, Governor Hochul will propose legislation to foster multifamily construction in zones drawn by municipalities around rail transit stops within commuting distance to New York City. The State will provide assistance

to municipalities for drafting the ordinance changes, easing the burden on smaller municipalities.

This action will expand housing options and job access for New Yorkers while reducing their need to own a car and minimizing traffic impacts.",132,133,high
2022,2022StateoftheStateBook.pdf,Housing / homelessness,Part V-B: Promote Housing Affordability by Expanding the Housing Supply,Give the City of New York Authority to Encourage Densification,Homes and Community Renewal,,other,no,,mixed,First-pass coding from 2022 SOTS table of contents.,2022-137,HCR,,other,mixed,no,,housing_general,agency report or official implementation evidence,first_pass_toc,,,,,"Existing New York State law limits the maximum density of residential floor area ratio (FAR) in New York City to 12.0, even though it does not limit the overall allowable floor area that may comprise other uses. Governor Hochul will propose a repeal of this antiquated limitation on the City's authority, and give the City the autonomy it should have to allow for denser residential development where appropriate.",133,133,high
2022,2022StateoftheStateBook.pdf,Housing / homelessness,Part V-B: Promote Housing Affordability by Expanding the Housing Supply,Ease Restrictions on Converting Hotels and Offices to Residential Uses,Homes and Community Renewal,,program/policy,no,,mixed,First-pass coding from 2022 SOTS table of contents.,2022-138,HCR,,program/policy,mixed,no,,office_conversion,agency report or official implementation evidence,first_pass_toc,,,,,"The ongoing shortage of housing in New York, combined with the post-pandemic rise of remote work that has emptied out offices and hotels, has given rise to the need for more flexible zoning rules that make it easier for buildings to convert commercial spaces into residential ones as needs change over time. Governor Hochul will propose legislation to facilitate conversions in the following manner:

• Hotel Conversions: Any Class B hotel located within (or within 800 feet of) a residential zoning district can use the existing certificate of occupancy for permanent residences, as long as the units are subject to applicable rent stabilization laws and agreements. Alterations must follow regulations for Class B hotels.

• Office Conversions: As noted above, Governor Hochul will remove the 12.0 maximum residential FAR in New York City, facilitating the conversion of

office buildings to residential use (while also supporting housing production). Additionally, until December 2027, office-to-residential conversions of buildings constructed before 1980 or any applicable buildings located south of 60th Street in Manhattan may be allowed. The legislation will also ease conversion through waivers of specific regulations.",133,134,high
2022,2022StateoftheStateBook.pdf,Housing / homelessness,Part V-B: Promote Housing Affordability by Expanding the Housing Supply,End the 421-a Tax Abatement and Establish a New Program That More Effectively Uses Public Dollars to Drive Affordability,Homes and Community Renewal,,program/governance,yes,,mixed,First-pass coding from 2022 SOTS table of contents.,2022-139,HCR,,program/governance,executive_action,mixed,implemented,housing_general,agency report or official implementation evidence,first_pass_toc,,,,,"There is a critical need for affordable and market-rate rental housing in New York City. Real estate tax abatements have historically driven the development of new rental units across the city with 200,000 apartments105 currently covered by the 421-a program. Since 2010, nearly half106 of all new residential units built in New York City took advantage of this program, which has spurred housing construction and the creation of thousands of affordable units.

With 421-a set to expire in 2022, there is an opportunity to enact a different kind of abatement program that can continue to incentivize rental housing construction across New York City while creating permanent and deeper affordability and spending taxpayer money more efficiently.

Governor Hochul will propose a new tax abatement that aims to achieve these goals:

• Create deeper affordability that services lower income households than 421- a. • Create longer-term affordability to provide more stability for low-income households. • Ensure long-term availability of affordable rental units in neighborhoods across the city. • Restructure the tax abatement to ensure maximum efficiency of taxpayer dollars.

• Align with city and state climate goals by requiring carbon-neutral technologies, electrification, and electrification-ready building systems. • Allow flexibility to enable construction of financially viable smaller buildings. • Create an all-affordable homeownership option to promote low- and moderate-income homeownership opportunities across the city.

Part V-C: Expand Housing Access and Equity to Keep More New Yorkers in Homes

America has a long history of housing injustice, from redlining to racial covenants to urban renewal, with patterns of discrimination that persist today. Many current instances of housing instability across New York have their roots in unfair practices that stifle housing access and opportunity for low-income or minority households in underserved communities. These structural barriers impact all of us, from the households facing eviction or homelessness to the taxpayer programs that might never be needed if more New Yorkers had stable homes.

To expand housing access and equity, Governor Hochul will propose initiatives designed to address unfair practices and improve housing stability for more New Yorkers, including those with weak credit histories, prior involvement in the criminal legal system, those vulnerable to eviction, and disaster victims. She will also make financing more accessible and available to owners of manufactured homes. Together these actions can help New York show a better way forward on housing justice.",134,135,high
2022,2022StateoftheStateBook.pdf,Housing / homelessness,Part V-C: Expand Housing Access and Equity to Keep More New Yorkers in Homes,Improve Housing Access for Renters with Justice Involvement or Negative Credit Histories,Homes and Community Renewal,,program/policy,no,,mixed,First-pass coding from 2022 SOTS table of contents.,2022-140,HCR,,program/policy,mixed,no,,housing_general,"implementation metrics, agency reports, or budget plus rollout evidence",first_pass_toc,,,,,"New Yorkers who have been involved in the justice system or who have negative credit histories face regular discrimination over rental housing access. Routine landlord screening for prospective tenants includes credit and criminal background

checks, and frequently leads to rejection for applicants whose credit scores fall below a certain threshold or show negative histories, and for applicants who have a conviction or arrest - regardless of conviction nature, length of time since it occurred, or age at the time of the offense. These screening processes exacerbate housing insecurity and disproportionately harm New York's most vulnerable residents, including people of color and domestic violence survivors.

To improve housing access and equity, Governor Hochul will propose two pieces of legislation designed to protect New Yorkers at risk of discrimination based on conviction or credit status.

• A Credit to New York: This legislation will prohibit residential landlords from automatically denying applicants on the basis of credit history or score if the applicant can demonstrate: (1) evidence of on-time, in-full rental payments for the 12 months preceding the application or 12 months preceding March 2020, (2) that they receive one or more rental subsidies that will pay their rent in full directly to the landlord, or (3) that the negative credit history or poor credit score is solely due to unpaid student loan or medical debt. If the landlord intends to deny an applicant because of their credit score or history, they must notify the applicant in writing and give the applicant five days to provide evidence of the above.

• Fair Chance Housing: This legislation will eliminate a private landlord's ability to automatically reject individuals with justice involvement and will require housing providers to conduct individualized assessments that account for the circumstances of a conviction and evidence of rehabilitation while still ensuring the safety and welfare of existing residents.",135,136,high
2022,2022StateoftheStateBook.pdf,Housing / homelessness,Part V-C: Expand Housing Access and Equity to Keep More New Yorkers in Homes,Create an Eviction Prevention Legal Assistance Program to Improve Housing Stability,Homes and Community Renewal,,program/governance,no,,mixed,First-pass coding from 2022 SOTS table of contents.,2022-141,HCR,,program/governance,executive_action,yes,created,housing_general,"executive order, agency launch, or official announcement",first_pass_toc,,,,,"With a statewide eviction moratorium set to end in January 2022, a spike in new evictions is anticipated.107 Housing tenants outside New York City are particularly vulnerable to eviction due to a lack of free legal representation. In Rochester and Albany, 33 percent of renter-occupied households are severely rent burdened; in Syracuse and Buffalo, 30 percent.108

New York City established a Right to Counsel in 2017 and provides free legal services to tenants facing eviction in housing court. Data shows that the overwhelming majority of tenants with legal representation are successful in their proceedings, with 84 percent109 able to remain in their homes. Such programs not only reduce housing instability for vulnerable New Yorkers but also reduce costs associated with homelessness support programs.

The Eviction Prevention Legal Assistance Program will provide free legal assistance to upstate renters who currently cannot afford counsel in eviction proceedings. The funding would apply to renters facing eviction with incomes at or below 200 percent of the federal poverty line and would be provided by local legal service providers, such as the Legal Aid Society of Northeastern New York, Legal Services of Central New York, Legal Assistance of Western New York, and other organizations.

Additionally, this initiative will expand the Fair Housing Testing program to provide additional fair housing testing and education throughout the state, including in counties not previously served by local fair housing organizations. This expansion will allow counties to respond to many more complaints and to proactively conduct testing on suspected systemic discrimination, in support of the New York State's larger anti-discrimination initiatives.",137,137,high
2022,2022StateoftheStateBook.pdf,Housing / homelessness,Part V-C: Expand Housing Access and Equity to Keep More New Yorkers in Homes,Make Financing More Accessible and Affordable for Manufactured Homes,Homes and Community Renewal,,other,no,,mixed,First-pass coding from 2022 SOTS table of contents.,2022-142,HCR,,other,mixed,no,,housing_general,agency report or official implementation evidence,first_pass_toc,,,,,"Manufactured homes provide an affordable housing alternative for hundreds of thousands of low- and middle-income New Yorkers. However, New York law prevents owners of manufactured homes from obtaining traditional mortgages, making purchasing more complicated and financing more expensive. Governor Hochul will work with the Legislature to make affordable mortgage financing available to these homeowners.",138,138,high
2022,2022StateoftheStateBook.pdf,Housing / homelessness,Part V-C: Expand Housing Access and Equity to Keep More New Yorkers in Homes,Create a Permanent Disaster Recovery and Resiliency Unit to Help Rebuild Homes,Homes and Community Renewal,,program/governance,no,,mixed,First-pass coding from 2022 SOTS table of contents.,2022-143,HCR,,program/governance,executive_action,yes,created,housing_general,"executive order, agency launch, or official announcement",first_pass_toc,,,,,"New York State is a national leader in disaster recovery and resiliency thanks to our innovative approach following Superstorm Sandy. In 2013 we established the Governor's Office of Storm Recovery (GOSR) as a centralized agency charged with planning, coordinating, and implementing recovery programs, but GOSR's federal funding expires in 2023, right as the risk of severe weather events continues to grow. Hurricane Ida's unexpected devastation on the state - impacting more than 1,200 homes and causing $50 million in damage to public infrastructure110 - underscores the need for a permanent recovery and resiliency program.

Governor Hochul will create a permanent New York State Disaster Recovery and Resiliency Unit housed in Homes and Community Renewal (HCR), preserving and building on the expertise and experience gained by GOSR since 2013. This permanent unit will facilitate administration of federal funds to meet recovery needs efficiently and empowered to use State funding to bridge any gaps between federal restrictions and New York's needs. The unit's core focus will include:

• Scaling recovery efforts and coordinating resiliency initiatives for both major and small disasters throughout the state. • Coordinating initial response and long-term recovery not covered by Federal Emergency Management Agency or State emergency response agencies.

• Identifying needs, deploying resources quickly and equitably, and tracking funding to all agencies after a storm. • Managing a portfolio of pre- and post-disaster programs, particularly those focused on homeowner rebuilding efforts, resiliency upgrades for homeowners and communities, and voluntary buyout sites. • Leveraging GOSR's expertise in data management to build online applications.

Part V-D : Direct Action to Meet the Homelessness Crisis

New York is a national leader in providing temporary shelter for people experiencing homelessness, resulting in a very low percentage of individuals living unhoused. Of the roughly 91,000111 homeless individuals statewide, only 5 percent live on the street or in places not meant for habitation. By contrast, in California, over 70 percent of homeless individuals live on the streets.112 Nonetheless, the disruption caused by COVID-19 caused a rise in the visible New York street homeless population, raising public awareness about the homelessness crisis and the need for effective government action to address it.

While individuals living on the street are often portrayed as the face of homelessness, most people who experience homelessness do so as a result of limited financial resources or affordable housing options. In that light, the number of homeless individuals is expected to increase in 2022, due to lost wages resulting from the economic fallout of the pandemic, as well as the end of the eviction moratorium.

Governor Hochul will propose a comprehensive strategy designed to address street homelessness and to prevent homelessness in the first place. These initiatives will take aim at the root causes of homelessness: lack of stable and affordable housing, unmet treatment needs for mental health or substance abuse, and poverty that forces people to choose between stable housing and other basic needs.

Across these efforts, the State will partner with local leaders to meet the needs of individuals and families experiencing homelessness and to provide the support and opportunities all New Yorkers deserve.",138,140,high
