year,source_document,section_bucket,subsection,proposal_title,lead_agency,supporting_agencies,commitment_type,quantified,metric_or_target,implementation_pathway,notes,commitment_id,lead_agency_standardized,supporting_agencies_standardized,item_type_clean,implementation_pathway_clean,binary_evaluable,binary_unit,overlap_theme,status_evidence_needed,source_quality,continuity_to_prior_year,matched_prior_commitment_id,matched_prior_title,match_basis,commitment_text,source_page,source_page_end,text_capture_confidence
2022,2022StateoftheStateBook.pdf,People / workforce / reentry / food systems,Part III-D: Support the Agriculture Workforce and Improve the Food Supply Chain,Enhance Agribusiness Child Development Centers to Support Farm Workers,Agriculture & Markets,OTDA,other,no,,mixed,First-pass coding from 2022 SOTS table of contents.,2022-069,Agriculture & Markets,OTDA,other,mixed,no,,food_access_agriculture,"implementation metrics, agency reports, or budget plus rollout evidence",first_pass_toc,,,,,"Production agriculture requires intensive work, particularly during the growing and harvesting seasons. As the COVID-19 pandemic caused daycares to temporarily close their doors - including Agri-Business Child Development (ABCD) Centers - essential farm workers faced the same difficult choices as other New Yorkers when

it came time to balancing work and childcare. Disproportionally, women stepped out of the agricultural workforce to care for their children, especially women of color.

New York will increase support for ABCD Centers statewide to continue to provide the highest-quality early childhood education and social services to farm workers and other eligible families with infants, toddlers, and preschoolers.

Additionally, capital investments in ABCD Centers will create safer environments and give the Centers more capacity to serve more children of essential workers. New York will also invest in increased family programming at these Centers.",76,77,high
2022,2022StateoftheStateBook.pdf,People / workforce / reentry / food systems,Part III-D: Support the Agriculture Workforce and Improve the Food Supply Chain,Improve the School Lunch Program by Transferring It into the Department of Agriculture and Markets,Department of Labor,,program/policy,no,,mixed,First-pass coding from 2022 SOTS table of contents.,2022-070,DOL,,program/policy,mixed,no,,food_access_agriculture,"implementation metrics, agency reports, or budget plus rollout evidence",first_pass_toc,,,,,"For 10 years, the U.S. Department of Agriculture has allowed schools to purchase from local farms for its Farm-to-School Program, better supporting local food production and workers. But the Office of the New York State Comptroller has found that almost two-thirds of school districts already participating in the Farm-to-School Program do not even know about that provision.58

To better connect schools and farmers and support local production, the State will transfer the administration of the National School Lunch Program from the State Education Department (SED) to the Department of Agriculture and Markets (AGM).

AGM will work with the Department of Health (DOH) to ensure that nutrition standards are met, and with the Office of General Services to develop guidelines specific to school food procurement. Housing the program at AGM will also help streamline State nutrition programs and leverage existing partnerships between AGM and other agencies and entities invested in this work.",77,77,high
2022,2022StateoftheStateBook.pdf,People / workforce / reentry / food systems,Part III-D: Support the Agriculture Workforce and Improve the Food Supply Chain,Build Local Food Systems to Ensure a Resilient Supply Chain,Agriculture & Markets,OTDA,capital/infrastructure,no,,mixed,First-pass coding from 2022 SOTS table of contents.,2022-071,Agriculture & Markets,OTDA,capital/infrastructure,mixed,no,,food_access_agriculture,agency report or official implementation evidence,first_pass_toc,,,,,"COVID-19 brought to light weaknesses in the local food supply chain, including difficulty for farmers' markets in adapting to an increasingly online marketplace and high costs of transporting food. Governor Hochul will take immediate actions to create a food system that can not only withstand a pandemic but also is accessible to all New Yorkers.

To ensure a more resilient food supply chain, the State will re-fund the Farmers' Market Resiliency Grant Program and establish a working group to connect upstate and downstate New York on food procurement and distribution. Grant funding will give farmers and small businesses an opportunity to build resiliency into their markets, including pivoting to online sales and delivery and investing in infrastructure to make local food accessible to more consumers. Convening experts to strengthen the connection between upstate and downstate will facilitate easier delivery of fresh, local, nutritious foods to those New Yorkers who need it most.",78,78,high
2022,2022StateoftheStateBook.pdf,People / workforce / reentry / food systems,Part III-D: Support the Agriculture Workforce and Improve the Food Supply Chain,Fund the “Nourish New York” Initiative to Feed New Yorkers and Support Farmers,Agriculture & Markets,OTDA,funding/tax/benefit,no,,executive_budget,First-pass coding from 2022 SOTS table of contents.,2022-072,Agriculture & Markets,OTDA,funding/tax/benefit,executive_budget,no,,food_access_agriculture,"implementation metrics, agency reports, or budget plus rollout evidence",first_pass_toc,,,,,"In November, Governor Hochul signed legislation59 making the Nourish New York Program permanent. Launched amid the severe supply chain disruptions brought on by the pandemic, this vital program supports both local farmers and underserved communities by purchasing surplus food supply and rerouting it to State food banks, providing an additional income stream for farmers while feeding families in need.

To date, Nourish New York has helped New York's network of food banks and emergency food providers purchase more than 35 million pounds of food from local farmers and delivered more than 29 million meals to communities across the state, with nearly 4,200 farms benefitting from the initiative.

To continue supporting farmers and feeding residents, Governor Hochul will fund the Nourish New York program annually. Through the collaboration of the AGM and DOH, the emergency food system will be provided additional funding to continue the purchase of New York State food from farmers and processors.",78,79,high
2022,2022StateoftheStateBook.pdf,People / workforce / reentry / food systems,Part III-D: Support the Agriculture Workforce and Improve the Food Supply Chain,Expand the Climate Resilient Farming Program to Better Prepare Farmers for Climate Change,Agriculture & Markets,OTDA,program/policy,no,,mixed,First-pass coding from 2022 SOTS table of contents.,2022-073,Agriculture & Markets,OTDA,program/policy,mixed,no,,food_access_agriculture,"implementation metrics, agency reports, or budget plus rollout evidence",first_pass_toc,,,,,"There is increasing demand for climate mitigation, resilience, and adaptation options from New York's 33,400 farms.60 New York State has provided funding through the Climate Resilient Farming (CRF) Program to assist 200 New York farms in reducing their operational impact on the environment and addressing the impacts of extreme weather events resulting from climate change. But the CRF grant program has been oversubscribed during its last two rounds by approximately 50 percent.

To help farms adapt to climate change, Governor Hochul will increase funding for the CRF program and its associated supporting initiatives. This action will advance New York's efforts to reduce agricultural greenhouse gases and advance on-farm and community-wide resiliency measures.

Additionally, expanded CRF funding can help access key opportunities for mitigation, resilience, and adaptation beyond the program's current offerings. These opportunities have emerged through evolving applied research funded through the CRF budget and conducted by the state's land grant college, Cornell University.",79,79,high
2022,2022StateoftheStateBook.pdf,People / workforce / reentry / food systems,Part III-D: Support the Agriculture Workforce and Improve the Food Supply Chain,Establish the BIPOC Farmer Engagement and Outreach Program to Better Support Diversity and Equity in New York Agriculture,Agriculture & Markets,OTDA,program/governance,no,,mixed,First-pass coding from 2022 SOTS table of contents.,2022-074,Agriculture & Markets,OTDA,program/governance,executive_action,yes,established,food_access_agriculture,"executive order, agency launch, or official announcement",first_pass_toc,,,,,"Recent agricultural surveys have shown increases in the participation of woman and Hispanic farmers, but a decline in Black farmers in New York.61 Consistent with our state's efforts to address the underrepresentation of minority groups in many

industries, and to dismantle barriers to social mobility, a long-term approach is needed to ensure diverse farmers are thriving in New York.

To better support diversity and equity in New York agriculture, Governor Hochul will establish the Black, Indigenous, and other People-of-Color (BIPOC) Farmer Engagement and Outreach Program, supporting the unique needs of BIPOC- identifying farmers and producers across the state. The program's initiatives will include:

• Taking input and feedback from the Diversity and Racial Equity Working Group62 established in 2020 at AGM, as well as other external stakeholders. • Helping to build an ongoing and sustainable relationship between farmers of color and AGM. • Providing a direct phone number and email address to connect with AGM staff to help navigate the various service providers and resources available to underrepresented groups in agriculture.

This first step will help expand farming opportunities to more New Yorkers, especially those in historically marginalized groups.",79,80,high
2022,2022StateoftheStateBook.pdf,People / workforce / reentry / food systems,Part III-D: Support the Agriculture Workforce and Improve the Food Supply Chain,Expand SNAP Access to New York State Farms,Agriculture & Markets,OTDA,program/policy,no,,mixed,First-pass coding from 2022 SOTS table of contents.,2022-075,Agriculture & Markets,OTDA,program/policy,mixed,no,,food_access_agriculture,"implementation metrics, agency reports, or budget plus rollout evidence",first_pass_toc,,,,,"New York will take a series of actions to remove barriers in connecting the Supplemental Nutrition Assistance Program (SNAP) beneficiaries with more healthy, locally produced food options. The State will become a national leader in facilitating SNAP EBT purchases direct from New York farmers online, clearing a major access hurdle. Additionally, SNAP recipients will receive a special FreshConnect benefit toward purchasing a food subscription from a Community Supported Agriculture (CSA) farm. These initiatives will assist underserved members of the community in accessing wholesome fresh food, while also supporting farmers across the state.",80,80,high
2022,2022StateoftheStateBook.pdf,People / workforce / reentry / food systems,Part III-D: Support the Agriculture Workforce and Improve the Food Supply Chain,"Create the New York State Grown & Certified Producers Infrastructure, Technology, Research, and Development Grant Program",Department of Labor,,program/governance,no,,mixed,First-pass coding from 2022 SOTS table of contents.,2022-076,DOL,,program/governance,executive_budget,yes,created,food_access_agriculture,budget appropriation or program line,first_pass_toc,,,,,"The Department of Agriculture and Markets has previously operated an Infrastructure Grant Program for the New York State Grown & Certified Producers (the state's food certification program). Governor Hochul will expand this grant program to include technology research and development alongside infrastructure, helping producers adopt state-of-the-art practices and explore new and innovative products that better meet consumer demand.

Farmers would be able to use this grant money to invest in farm infrastructure, purchase new technology and equipment, and conduct research to aid in the development of new products to be marketed under the New York State Grown & Certified program. This expansion will help our agricultural producers and processors adapt for a more resilient food system.",81,81,high
2022,2022StateoftheStateBook.pdf,People / workforce / reentry / food systems,Part III-D: Support the Agriculture Workforce and Improve the Food Supply Chain,Fund the Urban Farms and Community Gardens Grant Program,Agriculture & Markets,OTDA,legislation/regulation,no,,legislation_required,First-pass coding from 2022 SOTS table of contents.,2022-077,Agriculture & Markets,OTDA,legislation/regulation,legislation_required,mixed,implemented,food_access_agriculture,"budget appropriation, program awards, or fiscal documents",first_pass_toc,,,,,"COVID-19 brought to light weaknesses in the local food supply chain, including the difficulty New Yorkers face when trying to access food in food deserts and traditionally underserved communities. Additional action is needed to create a food system that can not only withstand a pandemic but is accessible to all New Yorkers. Governor Hochul will fund the Urban Farms and Community Gardens Grant Program to help make local food accessible to more residents, including those in food deserts and underserved communities, and to encourage more urban farming.",81,81,high
2022,2022StateoftheStateBook.pdf,People / workforce / reentry / food systems,Part III-D: Support the Agriculture Workforce and Improve the Food Supply Chain,Continue Leading the Nation in Hemp Production,Agriculture & Markets,OTDA,other,no,,mixed,First-pass coding from 2022 SOTS table of contents.,2022-078,Agriculture & Markets,OTDA,other,mixed,no,,food_access_agriculture,agency report or official implementation evidence,first_pass_toc,,,,,"Following the Federal Agriculture Improvement Act of 2018 that significantly changed federal regulation for hemp cultivation in the U.S., New York State now has

a USDA-approved Hemp Program Plan in place. AGM has developed program regulations to add clarity and certainty for hemp growers, and added program staff to better serve the regulated community. Additionally, to meet new federal requirements for increased sampling and testing of hemp crops, AGM will be training and certifying private sampling agents to take regulatory samples, ensuring compliance with the federal standard for hemp of not more than 0.3 percent THC.

To bolster the increased interest in the use of hemp for grain and fiber applications, New York State will establish a grain and fiber working group at AGM to coordinate the activities of state, federal, and industry partners on workforce development and training needs, sampling and testing, and research and market opportunities. Additionally, New York State will continue supporting the work of Cornell University in developing new commercial cultivars in grain, fiber, and cannabidiol (CBD), as well as in developing new processing technologies for industrial hemp.

Part III-E: Protect New York's Consumers and Improve Financial Health

The recovery has shown that rebuilding New York requires improving the long-term financial health and resilience of all New Yorkers, especially for those living in the historically underserved communities that were disproportionately impacted by the pandemic. Too many New Yorkers are burdened with debt, including student debt and medical debt. Unable to immediately pay off these debts, they often face abusive and punitive practices that lead to increased and undeserved financial pressure.

Ensuring financial opportunity requires both protecting consumers from unfair and deceptive practices, and supporting more equitable practices and programs for wealth creation and financial health for all New Yorkers. COVID-19 has shown us that unexpected events will arise and New Yorkers must have the financial security to weather these storms, as well as access to safe financial products and tools to financially thrive.

Governor Hochul has a plan to protect New Yorkers against fraud and abuse and to promote financial security for all New Yorkers.",81,83,high
2022,2022StateoftheStateBook.pdf,People / workforce / reentry / food systems,Part III-E: Protect New York’s Consumers and Improve Financial Health,Automate Debt Forgiveness for State Employees,Department of Labor,,other,no,,mixed,First-pass coding from 2022 SOTS table of contents.,2022-079,DOL,,other,mixed,no,,unclear,agency report or official implementation evidence,first_pass_toc,,,,,"The Public Service Loan Forgiveness (PSLF) Program offers New York State employees student loan forgiveness after 10 years of qualifying service. Until recently, the implementation of the PSLF Program has been dismal. More than 98 percent of applicants have been denied the financial relief they were promised.63 In collaboration with the federal government, Governor Hochul will work to automate the application process as much as possible to increase participation, minimize paperwork, and eliminate the mistakes that slow approvals.

Governor Hochul will propose legislation to amend the Public Officers Law so the State may share records of employees with the U.S. Department of Education (DOE) to enroll them in the PSLF Program. U.S. DOE is currently developing a program to automate loan forgiveness, and this legal change would lay the groundwork for State participation in the federal program. Governor Hochul will work with the Office of the New York State Comptroller and relevant federal partners to participate in this program to the fullest.

Once launched, the student protection unit of the Department of Financial Services (DFS) will work with the Governor's Office of Employee Relations to educate State employers about the streamlined application process, making it easier for them to enroll their workforce.",83,83,high
2022,2022StateoftheStateBook.pdf,People / workforce / reentry / food systems,Part III-E: Protect New York’s Consumers and Improve Financial Health,Stop Transcript Withholding from SUNY/CUNY,Higher Education Services Corporation,SUNY; CUNY,program/policy,no,,mixed,First-pass coding from 2022 SOTS table of contents.,2022-080,Higher Education Services Corporation,SUNY; CUNY,program/policy,mixed,no,,college_workforce_pathways,agency report or official implementation evidence,first_pass_toc,,,,,"Schools withhold transcripts as a debt-collection mechanism for students or graduates with outstanding accounts. As a result, thousands of New Yorkers are unable to obtain their transcripts from higher education institutions across the

state, because they owe small amounts of money, such as tuition fees, library fines, or parking tickets. Transcript withholding is a harmful debt-collection practice that prevents students - particularly low-income students - from being able to transfer credits, finish their degrees, and obtain jobs that could help them pay their balances.

Governor Hochul will propose legislation to prohibit higher education institutions from withholding an official transcript from a current or former student on the grounds that the student owes a debt. Governor Hochul will direct the SUNY and CUNY systems to immediately stop withholding transcripts due to unpaid bills. Notably, CUNY announced a temporary hold on the practice in August 2021.",83,84,high
2022,2022StateoftheStateBook.pdf,People / workforce / reentry / food systems,Part III-E: Protect New York’s Consumers and Improve Financial Health,Make New York State Higher Education Services Corporation Loan Forgiveness Awards Tax Exempt,Higher Education Services Corporation,,other,no,,mixed,First-pass coding from 2022 SOTS table of contents.,2022-081,Higher Education Services Corporation,,other,mixed,no,,unclear,agency report or official implementation evidence,first_pass_toc,,,,,"Student loans forgiven under the Public Service Loan Forgiveness Program are exempt from federal and state income tax, as are other similar Federal programs. But awards provided by the New York State Higher Education Services Corporation (HESC) as part of its loan forgiveness program are not currently excluded from tax. These programs provide awards for graduates working in certain professions, such as social workers, farmers, and legal services. More than 2,000 New Yorkers receive awards through these programs. Moving forward, New York State will exclude HESC Loan Forgiveness programs from State income tax in order to relieve students of the burden of paying state income tax on the value of these awards.",84,84,high
2022,2022StateoftheStateBook.pdf,People / workforce / reentry / food systems,Part III-E: Protect New York’s Consumers and Improve Financial Health,Protect Consumers from Healthcare Provider Misinformation,Department of Labor,,program/policy,no,,mixed,First-pass coding from 2022 SOTS table of contents.,2022-082,DOL,,program/policy,mixed,no,,unclear,agency report or official implementation evidence,first_pass_toc,,,,,"Surprise medical bills create crushing financial and mental stresses for people just as they are recovering. Many New Yorkers try to do the right thing - wading through confusing websites to check that their provider is covered by their insurance before seeking care - only to learn they were mistaken and get hit with

huge out-of-network fees. Building on federal legislation, Governor Hochul will adopt a new regulation to protect consumers against misinformation that can lead to unexpected costs in the delivery of healthcare.

These protections will ensure that New Yorkers are not charged surprise out-of- network costs when a healthcare provider is incorrectly listed as in-network in the insurer's provider directory, an insurer provides incorrect information about a provider's network participation status in response to a request from a consumer, or the insurer fails to respond to a consumer's request for such information.",84,85,high
2022,2022StateoftheStateBook.pdf,People / workforce / reentry / food systems,Part III-E: Protect New York’s Consumers and Improve Financial Health,Create the Pharmacy Benefits Bureau to Lower the Cost of Prescription Drugs,Department of Labor,,program/governance,no,,mixed,First-pass coding from 2022 SOTS table of contents.,2022-083,DOL,,program/governance,executive_action,yes,created,unclear,"executive order, agency launch, or official announcement",first_pass_toc,,,,,"In December 2021, Governor Hochul signed into law the most comprehensive regulatory regime for pharmacy benefit managers (PBMs) in the country. PBMs are key intermediaries in the prescription drug supply chain that have long operated without regulatory oversight or disclosure of their business practices or conflicts of interest. While they are hired by insurance providers to negotiate down the costs of drugs from manufacturers and pharmacies, they often pocket these savings instead of passing them to consumers. This law will establish a new PBM licensing and e- registration program to shine a light on this industry.

To build on this landmark reform, Governor Hochul will create a new Pharmacy Benefits Bureau in the Department of Financial Services (DFS) to lead efforts to lower drug prices, the number one driver of insurance premium increases.

The new Bureau will begin licensing PBMs and will issue comprehensive regulations to ensure transparency and accountability for PBM practices. The Bureau will also hire a new compliance team to investigate PBM business practices and review complaints of misconduct. Additionally, this team will expand DFS's ongoing efforts to investigate significant spikes in prescription drug prices and to require drug

manufacturers - or whoever is responsible for the price increase - to show a reasonable justification for sudden increases.

With this new team, New York will bring a multi-pronged approach to attacking high drug prices both at the manufacturer level and at the dispensing level.",85,86,high
