year,source_document,section_bucket,subsection,proposal_title,lead_agency,supporting_agencies,commitment_type,quantified,metric_or_target,implementation_pathway,notes,commitment_id,lead_agency_standardized,supporting_agencies_standardized,item_type_clean,implementation_pathway_clean,binary_evaluable,binary_unit,overlap_theme,status_evidence_needed,source_quality,continuity_to_prior_year,matched_prior_commitment_id,matched_prior_title,match_basis,commitment_text,source_page,source_page_end,text_capture_confidence
2022,2022StateoftheStateBook.pdf,Schools / higher education,Part VII-A: Increase Support for Educators and Children,Accelerate the Teacher Certification Process,State Education Department,,other,no,,mixed,First-pass coding from 2022 SOTS table of contents.,2022-176,SED,,other,mixed,no,,education_general,agency report or official implementation evidence,first_pass_toc,,,,,"It can often take a long time for qualified teachers to receive the certification that enables them to start working in classrooms, due to both administrative and

ministerial challenges. To better streamline the state's teacher certification process, Governor Hochul will accelerate the teacher approval process through two actions, ensuring that qualified teachers can enter the classroom without bureaucratic delays:

• Provide Additional Staff for the State Education Department (SED): Governor Hochul will invest in SED's teacher certification office to reduce review time for teacher certification applications. This funding will enable SED to shorten the time from application to final certification of teacher candidates who can be approved to teach in New York immediately.

• Allow Provisional School Professionals in Classrooms: Governor Hochul proposes to reform the state's certification statute to provisionally approve teachers for immediate work if they meet coursework, fingerprint, and background check requirements. This action would enable teacher candidates to teach while they wait for SED to complete its lengthy approval process. Provisional approval would also be extended to school counselors, social workers, and other SED-licensed professions with current job market shortages, as well as for retirees with expired licenses in good standing. Additionally, the requirement for SED approval to renew expired licenses for individuals with clean records would be waived, at least during the teacher shortage.",172,173,high
2022,2022StateoftheStateBook.pdf,Schools / higher education,Part VII-A: Increase Support for Educators and Children,Create a State Teacher Residency Program,State Education Department,,program/governance,no,,mixed,First-pass coding from 2022 SOTS table of contents.,2022-177,SED,,program/governance,executive_action,yes,created,education_general,"executive order, agency launch, or official announcement",first_pass_toc,,,,,"Teacher residency programs, in which teachers in training are given a mentor and real teaching experience under the mentor's supervision, have been proven to dramatically increase teacher retention rates and improve the experience of educators in the early, toughest years of teaching.

Governor Hochul will create the Empire State Teacher Residency Program, which would provide matching funding for local districts to create two-year residency programs for graduate-level teacher candidates. Funded programs would involve SUNY, the City University of New York (CUNY), and/or private colleges partnering with public school districts to provide reduced or free tuition for teaching candidates, including books and fees, mentoring, and a stipend to cover living expenses. The program will prioritize diversity among teacher residents and partnering mentors and will place an emphasis on both high-need subject areas and geographic locations with teacher shortages.",173,174,high
2022,2022StateoftheStateBook.pdf,Schools / higher education,Part VII-A: Increase Support for Educators and Children,Fund New Cohorts of the Master Teacher Program,State Education Department,,funding/tax/benefit,no,,executive_budget,First-pass coding from 2022 SOTS table of contents.,2022-178,SED,,funding/tax/benefit,executive_budget,mixed,implemented,education_general,agency report or official implementation evidence,first_pass_toc,,,,,"New York's Master Teacher Program is a professional community of outstanding teachers who are dedicated to supporting the development of the next generation of great educators. Master Teachers foster a supportive environment for pre-service and early career teachers, engage in peer mentoring, and share insights into the most innovative practices across all grades and regions. To date, the program has awarded tens of millions of dollars to 1,200 teachers.

Currently, the Master Teacher Program focuses on three domains: STEM content; Pedagogy; and Students, Families, and Communities. To expand this successful mentoring model, Governor Hochul will fund new program cohorts, aimed at supporting teachers of color, Career and Technical Education (CTE) teachers, and guidance counselors. Special programming will focus on ensuring that all students have information and opportunities about CTE programs and alternative career pathways.",174,174,high
2022,2022StateoftheStateBook.pdf,Schools / higher education,Part VII-A: Increase Support for Educators and Children,Upskill Teacher Support Workers to Earn Their Certifications,State Education Department,,other,no,,mixed,First-pass coding from 2022 SOTS table of contents.,2022-179,SED,,other,mixed,no,,education_general,"implementation metrics, agency reports, or budget plus rollout evidence",first_pass_toc,,,,,"There are more than 100,000 paraprofessionals and teaching assistants151 working in New York State schools - a number that is rapidly rising152 - and many of them

would pursue their full teaching certification with greater support. Governor Hochul will provide funding for paraprofessionals to gain skills and credentials to become teachers, with a priority on diversity in the workforce. The program will cover two years of part-time tuition, fees, and books at SUNY and CUNY for those awarded paraprofessionals who remain employed in a school district while pursuing a teaching degree, and it will provide support for participants pursuing a teaching degree. School districts would be required to pair candidates with professional mentors.",174,175,high
2022,2022StateoftheStateBook.pdf,Schools / higher education,Part VII-A: Increase Support for Educators and Children,Provide Schools with Billions of Dollars by Fully Funding Foundation Aid,State Education Department,,other,no,,executive_budget,First-pass coding from 2022 SOTS table of contents.,2022-180,SED,,other,executive_budget,no,,public_education_funding,"budget appropriation, program awards, or fiscal documents",first_pass_toc,,,,,"In October, Governor Hochul announced that the State will phase in full funding of Foundation Aid to New York school districts by the 2023-24 school year.153 Foundation Aid is the State's main education operating aid formula. It is focused on allocating State funds equitably to all school districts, especially high-need districts, based on student need, community wealth, and regional cost differences. This decision means the state will provide billions of dollars more in aid to school districts statewide.

Governor Hochul's decision to fully fund Foundation Aid brings to an end a 29-year battle over adequate funding of public schools, particularly those with higher-need students. This bold decision means all schools will now receive equitable resources. New York State is home to the best-funded public P-12 education system in the world, spending more per pupil than any other state in the nation.154",175,175,high
2022,2022StateoftheStateBook.pdf,Schools / higher education,Part VII-A: Increase Support for Educators and Children,"Increase Access to Childcare for 100,000 Families and Invest $75 Million in Wages for Childcare Workers",State Education Department,OCFS,funding/tax/benefit,yes,"$75 Million; 100,000 Families",executive_budget,First-pass coding from 2022 SOTS table of contents.,2022-181,SED,OCFS,funding/tax/benefit,executive_budget,no,,education_general,"implementation metrics, agency reports, or budget plus rollout evidence",first_pass_toc,,,,,"Childcare is essential to give children the best possible chance at success and parents the ability to participate and advance in the workforce. Governor Hochul strongly believes the federal government must act to pass Build Back Better and

dramatically expand childcare coverage for families in New York and across the nation. In the event that there is no federal action, she will propose an expansion of access to childcare for 100,000 New York families, by increasing eligibility from 200 percent of the federal poverty line to 225 percent, and investing $75 million in better pay for childcare workers.

These are critical steps toward making childcare affordable for every family who needs it and realizing the goals developed by New York's Child Care Availability Task Force, which Governor Hochul co-chaired as Lieutenant Governor.

Part VII-B: Rebuild the Academic and School Mental Health Supports Worsened by the Pandemic

The impact of COVID-19 on entire generations of students is staggering. One imminent priority is addressing the significant learning loss that occurred due to remote learning - deficits with the potential to follow students for years. Pandemic-driven deficits in math and reading could result in American students earning some $61,000 less over their careers unless we close the pandemic learning gap.155

Equally critical is addressing the social-emotional challenges that students are facing as a result of the pandemic. And while New York State was already facing a pre-pandemic gap in access to children's mental healthcare, that gap has only widened. One CDC study found that, between April and October 2020, there was a 24 percent156 rise in the proportion of mental health emergency visits for children ages 5 to 11, compared with the same window in 2019.

Both of these challenges have had a disproportionately high impact on racial minorities. One of every 600 Black children and 1 of every 700 Hispanic children lost a parent or caregiver during the pandemic, compared to 1 of every 1,400 Asian and 1 of every 1,500 white children.157

Governor Hochul will help New York's school children get on and stay on the road to recovery through initiatives that close the academic and social-emotional gaps widened by COVID-19, ensuring that the pandemic does not prevent students from getting all the educational opportunities they need and deserve.",175,177,high
2022,2022StateoftheStateBook.pdf,Schools / higher education,Part VII-B: Rebuild the Academic and School Mental Health Supports Worsened by the,Provide Learning and Mental Health Grants to High-Need Districts,State Education Department,,other,no,,mixed,First-pass coding from 2022 SOTS table of contents.,2022-182,SED,,other,executive_budget,no,,education_general,"budget appropriation, program awards, or fiscal documents",first_pass_toc,,,,,"Governor Hochul will provide additional mental health grants to school districts and encourage school districts to invest federal funding to address the student trauma brought on by the COVID-19 pandemic by providing a new state matching fund, the Recover from COVID School Program (RECOVS), prioritizing districts with the highest needs. This funding will help create or expand summer learning, after- school, or extended-day and extended-year programs to help students make up academic ground. It will also support the hiring of mental health professionals, the expansion of school-based mental health services, and other evidence-based mental health supports for students and school staff.",177,177,high
2022,2022StateoftheStateBook.pdf,Schools / higher education,Part VII-B: Rebuild the Academic and School Mental Health Supports Worsened by the,Connect the Student Service Corps with Community Groups to Meet Local Needs,State Education Department,,other,no,,mixed,First-pass coding from 2022 SOTS table of contents.,2022-183,SED,,other,mixed,no,,education_general,agency report or official implementation evidence,first_pass_toc,,,,,"There are tens of thousands of SUNY and CUNY students in graduate or undergraduate programs in education-related fields such as childcare, counseling, education, social work, and more. Building on a successful model in Puerto Rico, Governor Hochul will launch an initiative to connect SUNY and CUNY student volunteers with local nonprofit partners to fill critical community needs identified by local stakeholders.

Volunteers will focus on providing support in education and tutoring, hunger prevention, mental health, and after-school activities, among other areas. Students

will get academic credit and meet weekly hour requirements for providing services, working in concert with providers, local schools, and their colleges.",177,178,high
2022,2022StateoftheStateBook.pdf,Schools / higher education,Part VII-B: Rebuild the Academic and School Mental Health Supports Worsened by the,Pilot Programs to Create Positive School Climates,State Education Department,,program/governance,no,,mixed,First-pass coding from 2022 SOTS table of contents.,2022-184,SED,,program/governance,executive_action,mixed,implemented,education_general,agency report or official implementation evidence,first_pass_toc,,,,,"Locally funded programs designed to create positive school climates have demonstrated promising results. Some participating schools have seen an 82 percent decrease in suspensions since 2013-14 and a reduction in violent incidents by 54 percent.158 To help build more positive school climates at a moment of great need during the recovery, Governor Hochul will fund pilot programs to create safe, positive, and supportive climates in high-need schools.

Funding will focus on meeting students' holistic needs, with programs supporting Therapeutic Crisis Intervention for Schools, Response to Intervention, Positive Behavioral Interventions and Supports, the Human Rights Campaign Foundation's Welcoming Schools initiative, and the United Federation of Teachers' Positive Learning Collaborative, among others. Funding could also be used for programs that address other options to improve school climate. To ensure the programs help parts of the state that need it most, funding will prioritize schools with high levels of suspensions coupled with high levels of student poverty, homelessness, special needs students, English language learners, and other vulnerable populations.

Part VII-C: Help Two-Thirds of New Yorkers Earn a Post-Secondary Degree by

Just as New York is at risk of an unequal recovery from the pandemic, New York's students face an unequal path to job opportunities and career success. COVID-19 accelerated the economic changes already taking shape in the state. In the coming years, an estimated 70 percent of all new jobs in the U.S. will require some post- secondary credential, and by 2024, nearly 3.5 million jobs in New York State will require an associate degree or higher.159 At the same time, some 53 percent160 of

New York State jobs may be impacted by automation in the years ahead, with roles in administrative support, sales, food prep, and other service sectors at greatest risk.

Aggressive policy interventions are needed to ensure that all New Yorkers have access to the higher education opportunities that will translate into job opportunities in high-growth industries. Governor Hochul has a comprehensive plan to make higher education in our state more affordable and accessible: whether students are seeking a two-year degree, a four-year degree, or a non-degree credential; whether they are going full-time or part-time; and whether they are looking for their first job, or a new and better job. These actions will help two-thirds of New Yorkers earn a post-secondary credential (degree or non-degree) by 2030.

A stronger future for New York's economy begins with a stronger investment in higher education and giving our people the skills they need to succeed.",178,179,high
2022,2022StateoftheStateBook.pdf,Schools / higher education,Part VII-C: Help Two-Thirds of New Yorkers Earn a Post-Secondary Degree by 2030,Expand Access to College-Level Courses,State Education Department,,program/policy,no,,mixed,First-pass coding from 2022 SOTS table of contents.,2022-185,SED,,program/policy,mixed,no,,education_general,"implementation metrics, agency reports, or budget plus rollout evidence",first_pass_toc,,,,,"College-level courses provided in high school, or ""concurrent enrollment"" programs, help New York's students get a head start on college completion, reduce their student debt, and accelerate their job prospects. But funding for these programs is provided on a grant basis and is disconnected from the relative success of programs in effectively helping students earn college credit and matriculate to an institute of higher education. Moreover, the pandemic created additional challenges161 for high school students trying to complete these programs remotely.

To change this paradigm, Governor Hochul will propose reforms to incentivize early college high school programs that are the most successful in matriculating students to college with credits earned in high school (excluding AP and IB credits). With support tied to success, Governor Hochul will encourage the establishment and growth of effective concurrent enrollment programs, and in doing so, put more and

more students on a path to getting a post-secondary educational credential and the employment opportunities that come with it.",179,180,high
2022,2022StateoftheStateBook.pdf,Schools / higher education,Part VII-C: Help Two-Thirds of New Yorkers Earn a Post-Secondary Degree by 2030,"Expand the Part-Time Tuition Assistance Program to Serve 75,000 Additional Students",Higher Education Services Corporation,,program/policy,yes,,mixed,First-pass coding from 2022 SOTS table of contents.,2022-186,Higher Education Services Corporation,,program/policy,mixed,no,,education_general,"implementation metrics, agency reports, or budget plus rollout evidence",first_pass_toc,,,,,"New York's Tuition Assistance Program (TAP) is largely unavailable for students studying part time. To be eligible for part-time TAP, students are required to attend school full time for a year before receiving awards, and they also must have earned 12 credits or more in each of the two previous semesters - with a minimum of 24 credits earned in the previous year.

Expanding access to part-time TAP would allow students with work or family responsibilities to attend school without upending their lives. It would also help revitalize community colleges by building enrollment with a new population of students.

Governor Hochul has a plan to expand part-time TAP for New York's SUNY and CUNY students that is as revolutionary as it is simple. She will eliminate the 24- credit prior-year eligibility requirement, and instead make prorated awards available to any individual enrolled in six or more credits of study at a SUNY, CUNY, or not-for-profit independent college.

Governor Hochul's plan will expand tuition assistance to provide support to 75,000 additional New York students annually, all working hard to get ahead.",180,180,high
2022,2022StateoftheStateBook.pdf,Schools / higher education,Part VII-C: Help Two-Thirds of New Yorkers Earn a Post-Secondary Degree by 2030,Provide Tuition-Free Workforce Credential Programs at Community Colleges for High-Demand Fields,State Education Department,,staffing/workforce,no,,mixed,First-pass coding from 2022 SOTS table of contents.,2022-187,SED,,staffing/workforce,mixed,mixed,implemented,college_workforce_pathways,agency report or official implementation evidence,first_pass_toc,,,,,"Non-degree workforce credential programs provide critical skills to New Yorkers seeking jobs in an ever-changing economy, and help employers find workers to

meet their needs. There may be no more important area for state investment when it comes to workforce development.

Governor Hochul will therefore create a financial aid program that fully funds workforce credential sequences at community colleges in high-demand fields. To ensure the program focuses on the highest-growth areas, Empire State Development (ESD) and the State's Regional Economic Development Councils (REDCs) will recommend which courses of sequence would be eligible for State funding, based on an analysis of regional industry trends and workforce needs. This analysis will take into account existing offerings that are privately supported, ensuring that the state is investing its resources into areas that truly need state support.",180,181,high
2022,2022StateoftheStateBook.pdf,Schools / higher education,Part VII-C: Help Two-Thirds of New Yorkers Earn a Post-Secondary Degree by 2030,Provide Childcare at All SUNY/CUNY Campuses,SUNY,SUNY; CUNY; OCFS,other,no,,mixed,First-pass coding from 2022 SOTS table of contents.,2022-188,SUNY,SUNY; CUNY; OCFS,other,mixed,no,,college_workforce_pathways,agency report or official implementation evidence,first_pass_toc,,,,,"Access to affordable childcare can be a major barrier for New Yorkers trying to pursue higher education or workforce development courses at state institutions. Currently, 18 SUNY162 and eight CUNY campuses lack on-site childcare. To close this gap, Governor Hochul will expand childcare to all SUNY and CUNY campuses, providing support for more New Yorkers working hard to get their education and improve their job skills.",181,181,high
2022,2022StateoftheStateBook.pdf,Schools / higher education,Part VII-C: Help Two-Thirds of New Yorkers Earn a Post-Secondary Degree by 2030,Award Prior Learning Credit Across SUNY and CUNY,SUNY,SUNY; CUNY,other,no,,mixed,First-pass coding from 2022 SOTS table of contents.,2022-189,SUNY,SUNY; CUNY,other,mixed,no,,college_workforce_pathways,agency report or official implementation evidence,first_pass_toc,,,,,"As described in Section I, as part of the Governor's plan to make it easier for New Yorkers to move between college and career, SUNY and CUNY will adopt a consistent, statewide policy for crediting relevant prior learning and work experience, supporting credit accumulation, certifications, and post-secondary attainment. Under this policy, all students in SUNY and CUNY schools will have a far more seamless experience returning to school to gain the necessary credentials to move up the career ladder.",181,181,high
