commitment_id,proposal_title,overlap_theme,continuity_to_prior_year,matched_prior_commitment_id,matched_prior_title,match_basis
2023001,Set Goals for New Home Construction Across the State,housing_supply,new,,,
2023002,Facilitate Housing Approval When Localities Do Not Meet Goals,housing_general,continuation,2022130,Build and Preserve Senior Housing Across the State,theme=housing_general; shared_terms=housing
2023003,Encourage New Housing Near Transit,transit_oriented_housing,continuation,2022136,Spur Transit-Oriented Development,theme=transit_oriented_housing; shared_terms=transit
2023004,Provide $250 Million to Support Planning and Infrastructure Needs,housing_planning_governance,new,,,
2023005,Establish Statewide Database to Promote Transparency,housing_planning_governance,new,,,
2023006,Remove Obstacles to Housing Approvals,housing_planning_governance,new,,,
2023007,Give the City of New York the Flexibility to Increase Residential Capacity,housing_supply,new,,,
2023008,Create Greater Opportunities to Convert Office Spaces to Residential Housing,office_conversion,continuation,2022138,Ease Restrictions on Converting Hotels and Offices to Residential Uses,theme=office_conversion; shared_terms=residential
2023009,Authorize the City of New York to Legalize Basement Apartments,basement_apartments,new,,,
2023010,Offer Critical Incentives to Build and Rehabilitate Housing,housing_supply,new,,,
2023011,Address Childhood Lead Poisoning in High-Risk Areas Outside of New York City,lead_remediation_housing,new,,,
2023012,Support Homeowners in High-Need Communities of Color,housing_general,continuation,2022128,"Create and Preserve 100,000 Low-Income Rental and Co-Operative Housing Units in Both Urban and Rural Communities",theme=housing_general; shared_terms=communities
2023013,Expand the Tenant Protection Unit,tenant_protection,new,,,
2023014,Reclaim Vacant and Abandoned Homes,housing_general,continuation,2022142,Make Financing More Accessible and Affordable for Manufactured Homes,theme=housing_general; shared_terms=homes
2023015,Include Child Care in New Residential Construction,child_care_access,new,,,
2023016,Create a Housing Planning Office,housing_planning_governance,new,,,
2023017,Expand Insurance Coverage for Mental Health Services,mental_health_insurance,expansion,2022033,Integrate Mental Health Services into Pediatric Primary Care,"theme=mental_health_insurance; shared_terms=health, mental, services"
2023018,Expand Mental Health Services for School-Aged Children,mental_health_youth,new,,,
2023019,"Increase Operational Capacity for Inpatient Psychiatric Treatment by 1,000 Beds",psychiatric_capacity,new,,,
2023020,Improve Admissions and Discharge Planning and Establish Systemic Accountability,mental_health_general,new,,,
2023021,Dramatically Expand Outpatient Services,mental_health_general,new,,,
2023022,"Create 3,500 New Housing Units for Individuals with Mental Illness",mental_health_supportive_housing,continuation,2022129,"Create and Preserve 10,000 Supportive Housing Units","theme=mental_health_supportive_housing; shared_terms=housing, units"
2023023,Double Investment in Alternatives to Incarceration,alternatives_reentry,expansion,2022066,Eliminate Outdated Supervision Fees to Reduce Barriers for Individuals Returning to Society After Incarceration,theme=alternatives_reentry; shared_terms=incarceration
2023024,Triple Investment in Reentry Services to Improve Public Safety,alternatives_reentry,expansion,2022059,Refocus Parole Officers on Career Planning and Job Placement,theme=alternatives_reentry; shared_terms=
2023025,Expand the State’s Gun Involved Violence Elimination Program,gun_violence,expansion,2022046,Respond to Regional Needs in the Aftermath of Gun Violence,"theme=gun_violence; shared_terms=gun, violence"
2023026,Rebuild the State Police with a Targeted Focus on Fighting Serious Crimes,state_police_capacity,continuation,2022038,Double State Police Partnerships with Local Law Enforcement,theme=state_police_capacity; shared_terms=police
2023027,Launch an Unprecedented Four New State Police Academy Classes,state_police_capacity,continuation,2022038,Double State Police Partnerships with Local Law Enforcement,theme=state_police_capacity; shared_terms=police
2023028,Expand Community Stabilization Units to As Many As 25 Communities,public_safety_general,expansion,2022039,Invest in New York’s Crime Analysis Center Network,theme=public_safety_general; shared_terms=
2023029,Increase NYSP Participation on Federal Task Forces to Combat Violent Crime,gun_violence,new,,,
2023030,Expand the Work of Crime Analysis Centers and Include New York City,public_safety_general,expansion,2022039,Invest in New York’s Crime Analysis Center Network,"theme=public_safety_general; shared_terms=analysis, crime"
2023031,Hire Hundreds of New Prosecutors Around the State,state_police_capacity,new,,,
2023032,Provide Continued Funding for Discovery Reform,discovery_bail,new,,,
2023033,Make Improvements to the State’s Bail Laws,discovery_bail,new,,,
2023034,Reduce Gun Violence and Violent Crime Amongst Individuals Under Parole Supervision,gun_violence,continuation,2022046,Respond to Regional Needs in the Aftermath of Gun Violence,"theme=gun_violence; shared_terms=gun, violence"
2023035,Combat the Flow of Fentanyl Into Our Communities,public_safety_general,continuation,2022039,Invest in New York’s Crime Analysis Center Network,theme=public_safety_general; shared_terms=
2023036,Stabilize Fire Service Statewide to Improve Emergency Response,cyber_emergency_response,new,,,
2023037,Counter Cyber Threats,cyber_emergency_response,new,,,
2023038,Establish a Commission on the Future of Health Care,health_system_planning,new,,,
2023039,Provide Transformative Health Care Capital Funding,health_care_capital,new,,,
2023040,Establish A New Health Care Technology Capital Program,health_system_planning,new,,,
2023041,Reform Traveling Nurse Agency Staffing Practices,health_care_workforce_regulation,new,,,
2023042,Allow Health Care Providers to Do More,health_care_workforce_regulation,new,,,
2023043,Reform Approval Processes of Health Care Projects,health_care_workforce_regulation,new,,,
2023044,Expand Medicaid Coverage of Preventative Health Services,medicaid_coverage,expansion,2022020,Expand Medicaid Coverage for Postpartum Care,"theme=medicaid_coverage; shared_terms=coverage, medicaid"
2023045,Expand the Medicaid Buy-In Program for New Yorkers with Disabilities,medicaid_coverage,expansion,2022020,Expand Medicaid Coverage for Postpartum Care,theme=medicaid_coverage; shared_terms=medicaid
2023046,Improve Essential Plan Coverage,medicaid_coverage,follow_on,2022020,Expand Medicaid Coverage for Postpartum Care,theme=medicaid_coverage; shared_terms=coverage
2023047,Protect New Yorkers from Medical Debt and Other Burdensome Medical Costs,health_care_general,continuation,2022002,Increase the Training Capacity of Medical Institutions,theme=health_care_general; shared_terms=medical
2023048,Expand Access to Primary Care,primary_care_and_ems,expansion,2022021,Improve and Expand Access to Prenatal and Postnatal Care,"theme=primary_care_and_ems; shared_terms=access, care"
2023049,Revitalize Emergency Medical Services and Medical Transportation,primary_care_and_ems,new,,,
2023050,Ensure Access to Aging Services and High-Quality Long-Term Care,aging_long_term_care,follow_on,2022023,Establish a State Master Plan for Aging,manual override: 2023 text explicitly references the statewide Master Plan for Aging launched in 2022
2023051,Lead the Way for a Tobacco-Free Generation,health_care_general,continuation,2022001,Make a $10 Billion Investment in Healthcare and Support Wages for Workers,theme=health_care_general; shared_terms=
2023052,Save Lives Through Treatment of Opioid Addiction,opioid_response,continuation,2022030,Expand Mobile Treatment Services for Opioid Addiction,"theme=opioid_response; shared_terms=addiction, opioid, treatment"
2023053,End Preventable Epidemics,health_care_general,continuation,2022001,Make a $10 Billion Investment in Healthcare and Support Wages for Workers,theme=health_care_general; shared_terms=
2023054,Modernize our Health Reporting Systems,public_health_readiness,new,,,
2023055,Rebuild the Wadsworth Laboratories,health_care_capital,new,,,
2023056,Strengthen New York’s Public Health Emergency Readiness Capacity,public_health_readiness,new,,,
2023057,"Meet New York’s Climate Goals with a ""Cap-and-Invest"" Program That Prioritizes Affordability",cap_and_invest,new,,,
2023058,Make Energy More Affordable,energy_affordability,new,,,
2023059,Make Buildings More Sustainable,building_decarbonization,new,,,
2023060,Advance Transportation Electrification,transport_electrification,continuation,2022163,Achieve 100% Electric School Buses by 2035,theme=transport_electrification; shared_terms=
2023061,Ensure a Just Energy Transition,energy_affordability,new,,,
2023062,Reduce Waste and Invest in Local Recycling Programs,recycling_waste,continuation,2022170,Reduce Toxics in Packaging,theme=recycling_waste; shared_terms=reduce
2023063,Invest in Critical Water Quality Infrastructure,water_quality,continuation,2022165,"Increase Funding for the Clean Water, Clean Air and Green Jobs Environmental Bond Act to $4 Billion",theme=water_quality; shared_terms=water
2023064,"Clean Up ""Forever Chemicals""",climate_general,continuation,2022166,Expand Community Air Monitoring Statewide to Improve Air Quality,theme=climate_general; shared_terms=
2023065,Make Our Parks Energy-Independent,building_decarbonization,new,,,
2023066,Index the Minimum Wage,minimum_wage,new,,,
2023067,Make Historic New Investments in Public Education,public_education_funding,continuation,2022180,Provide Schools with Billions of Dollars by Fully Funding Foundation Aid,theme=public_education_funding; shared_terms=
2023068,Continue Major Commitment to Prekindergarten Expansion,public_education_funding,continuation,2022180,Provide Schools with Billions of Dollars by Fully Funding Foundation Aid,theme=public_education_funding; shared_terms=
2023069,Establish High-Impact Tutoring Programs Across the State to Address Learning Loss,tutoring_learning_loss,new,,,
2023070,Create New Early College High School and P-TECH Programs,college_workforce_pathways,continuation,2022187,Provide Tuition-Free Workforce Credential Programs at Community Colleges for High-Demand Fields,"theme=college_workforce_pathways; shared_terms=high, programs"
2023071,Create a Robust High School-College-Workforce Pipeline,college_workforce_pathways,continuation,2022187,Provide Tuition-Free Workforce Credential Programs at Community Colleges for High-Demand Fields,"theme=college_workforce_pathways; shared_terms=high, workforce"
2023072,Directly Admit All New York Students to Their Local Community Colleges,college_workforce_pathways,continuation,2022187,Provide Tuition-Free Workforce Credential Programs at Community Colleges for High-Demand Fields,"theme=college_workforce_pathways; shared_terms=colleges, community"
2023073,Initiate a Cascading Admissions Pilot to Ensure That Every Student Has a Place at SUNY,college_workforce_pathways,continuation,2022188,Provide Childcare at All SUNY/CUNY Campuses,theme=college_workforce_pathways; shared_terms=suny
2023074,Provide for Reasonable Tuition Flexibility Throughout CUNY and SUNY,college_workforce_pathways,continuation,2022188,Provide Childcare at All SUNY/CUNY Campuses,"theme=college_workforce_pathways; shared_terms=cuny, suny"
2023075,Establish a State Matching Fund for Endowment Contributions,education_general,continuation,2022178,Fund New Cohorts of the Master Teacher Program,theme=education_general; shared_terms=fund
2023076,Provide Funding for SUNY’s Transformation,college_workforce_pathways,continuation,2022188,Provide Childcare at All SUNY/CUNY Campuses,theme=college_workforce_pathways; shared_terms=suny
2023077,Modernize and Streamline the State’s Training and Employment Infrastructure,economic_development_general,follow_on,2022092,Spur Further Investment in the North Country and Adirondacks Through ORDA,theme=economic_development_general; shared_terms=
2023078,Match Federal Technology Innovation Funding,technology_innovation_economic_development,continuation,2022056,Expand the State’s Technology Talent Pipeline,theme=technology_innovation_economic_development; shared_terms=technology
2023079,Invest in Cell and Gene Therapy,technology_innovation_economic_development,new,,,
2023080,"Establish the Office of Semiconductor Expansion, Management and Integration",semiconductor_economic_development,continuation,2022123,Bring a New National Semiconductor Technology Center and Additional Chip Fabrication Plants to New York State,theme=semiconductor_economic_development; shared_terms=semiconductor
2023081,Improve the Excelsior Program to Attract Businesses and Jobs to New York State,economic_development_general,follow_on,2022092,Spur Further Investment in the North Country and Adirondacks Through ORDA,theme=economic_development_general; shared_terms=
2023082,Establish Minority and Women’s Business Enterprises Certification Reciprocity,economic_development_general,continuation,2022092,Spur Further Investment in the North Country and Adirondacks Through ORDA,theme=economic_development_general; shared_terms=
2023083,Take a Truly Statewide Approach to Economic Development Near Campuses,economic_development_general,continuation,2022120,Revitalize and Spur Economic Growth Across Downtowns,theme=economic_development_general; shared_terms=economic
2023084,Establish a New State Initiative to Focus on Supply Chain Resiliency,technology_innovation_economic_development,new,,,
2023085,Use State Purchasing Power to Bolster Demand for NY Agriculture,food_access_agriculture,continuation,2022074,Establish the BIPOC Farmer Engagement and Outreach Program to Better Support Diversity and Equity in New York Agriculture,theme=food_access_agriculture; shared_terms=agriculture
2023086,Create a Food Supply Workforce Pipeline,agriculture_general,new,,,
2023087,Make the Investment Tax Credit Refundable,agriculture_general,new,,,
2023088,"Support ""Scratch"" Cooking Facilities for School Food",food_access_agriculture,continuation,2022071,Build Local Food Systems to Ensure a Resilient Supply Chain,theme=food_access_agriculture; shared_terms=food
2023089,Expand Urban Agriculture Infrastructure and Community Gardens,food_access_agriculture,expansion,2022077,Fund the Urban Farms and Community Gardens Grant Program,"theme=food_access_agriculture; shared_terms=community, gardens, urban"
2023090,Provide Grant Funding to Expand Food Access,food_access_agriculture,expansion,2022075,Expand SNAP Access to New York State Farms,theme=food_access_agriculture; shared_terms=access
2023091,Increase Food Manufacturing,agriculture_general,new,,,
2023092,Protecting Reproductive Rights and Access,reproductive_rights,continuation,2022199,Protect Reproductive Access for All,"theme=reproductive_rights; shared_terms=access, reproductive"
2023093,Increase Reimbursement Rates for Reproductive Health Providers,reproductive_rights,expansion,2022199,Protect Reproductive Access for All,theme=reproductive_rights; shared_terms=reproductive
2023094,Implement Over-The-Counter Contraception Access,reproductive_rights,continuation,2022199,Protect Reproductive Access for All,theme=reproductive_rights; shared_terms=access
2023095,Safeguard Abortion Access through Data Privacy Protections,reproductive_rights,continuation,2022199,Protect Reproductive Access for All,theme=reproductive_rights; shared_terms=access
2023096,Ensure Abortion Access at Public College Campuses,reproductive_rights,continuation,2022199,Protect Reproductive Access for All,theme=reproductive_rights; shared_terms=access
2023097,Enact the Equal Rights Amendment,reproductive_rights,continuation,2022200,Pass an Equal Rights Amendment This Session,"theme=reproductive_rights; shared_terms=amendment, equal, rights"
2023098,Modernize Gender-Based Violence Policies and Procedures,equity_general,follow_on,2022034,Create the New York State Gender-Based Violence Training Institute,"theme=equity_general; shared_terms=based, gender, violence"
2023099,"Reinvigorate the Interagency Coordinating Council for Services to Persons Who Are Deaf, Deafblind, or Hard of Hearing",disability_inclusion,new,,,
2023100,Connect People with Disabilities to Inclusive Internships,disability_inclusion,continuation,2022057,Make New York a Model for the Employment of Workers with Disabilities,theme=disability_inclusion; shared_terms=disabilities
2023101,Designate New York as a Model Employer for People with Disabilities,disability_inclusion,continuation,2022057,Make New York a Model for the Employment of Workers with Disabilities,"theme=disability_inclusion; shared_terms=disabilities, model"
2023102,Increase Legal Services Support for Office for New Americans,immigrant_support,expansion,2022212,Strengthen the Office for New Americans,"theme=immigrant_support; shared_terms=americans, office"
2023103,Provide Funding for Refugee Resettlement Programs,immigrant_support,new,,,
2023104,Support Retraining for Immigrants with Experience in Specific Skilled Professions,immigrant_support,new,,,
2023105,Create Housing for Older LGBTQ+ New Yorkers,older_lgbtq_housing,new,,,
2023106,Protect New Yorkers from Predatory Banking Fees,equity_general,continuation,2022198,Create a Council on Gender Equity,theme=equity_general; shared_terms=
2023107,Increase Access to Education for Public Assistance Recipients,equity_general,expansion,2022198,Create a Council on Gender Equity,theme=equity_general; shared_terms=
2023108,Launch Mobile Veterans Service Centers,veterans_services,continuation,2022214,Reinforce Support for Local Veterans’ Service Agencies,"theme=veterans_services; shared_terms=service, veterans"
2023109,Improve Veteran and Military Cultural Competency in Supportive Housing,mental_health_supportive_housing,follow_on,2022129,"Create and Preserve 10,000 Supportive Housing Units","theme=mental_health_supportive_housing; shared_terms=housing, supportive"
2023110,Expand Fresh Connect Program to Fight Food Insecurity,equity_general,expansion,2022198,Create a Council on Gender Equity,theme=equity_general; shared_terms=
2023111,Streamline and Centralize the Application for Child Care Assistance,child_care_access,new,,,
2023112,Raise Eligibility to the Maximum Allowed Under Federal Law,government_general,new,,,
2023113,Expedite Enrollment for Families Receiving Other Benefits,government_general,new,,,
2023114,Rationalize Eligibility Requirements Across All Counties,government_general,new,,,
2023115,Establish Workforce Retention Grant Program,government_general,new,,,
2023116,Pilot a New York State Employer-Supported Child Care Program,child_care_access,new,,,
2023117,Adopt a Statewide Business Income Tax Credit for Child Care,child_care_access,new,,,
2023118,Create a Business Navigator Program,government_general,new,,,
2023119,Secure the MTA’s Future,mta_service_and_finance,follow_on,2022113,Advance the Transformative “Interborough Express” to Enhance Regional Mobility and Serve Nearly 1 Million New Yorkers,theme=mta_service_and_finance; shared_terms=
2023120,Make the MTA’s “City Ticket” Available 24/7,mta_service_and_finance,continuation,2022113,Advance the Transformative “Interborough Express” to Enhance Regional Mobility and Serve Nearly 1 Million New Yorkers,theme=mta_service_and_finance; shared_terms=
2023121,Move Forward on Light Rail Option for the Interborough Express,mta_service_and_finance,follow_on,2022113,Advance the Transformative “Interborough Express” to Enhance Regional Mobility and Serve Nearly 1 Million New Yorkers,"theme=mta_service_and_finance; shared_terms=express, interborough"
2023122,Expand EV Charging Infrastructure,transport_electrification,new,,,
2023123,Improve Bus Reliability,transportation_general,new,,,
2023124,Allow New York City to Lower Its Speed Limit,street_safety,new,,,
2023125,Spur Transportation Innovation Upstate,transportation_general,new,,,
2023126,Take High Risk Drivers Off the Road,street_safety,new,,,
2023127,Empower The Department of Transportation to Seize Dangerous Vehicles,street_safety,new,,,
2023128,Stop Secondary Crashes,street_safety,new,,,
2023129,Close the DWI Loophole,street_safety,new,,,
2023130,Make Customer Experience and Benefits Participation a State Priority,digital_government,new,,,
2023131,Simplify the Child Care Assistance Application Process,child_care_access,new,,,
2023132,"Improve the Client Experience of Food Benefits for Women, Infants and Children",government_operations_general,new,,,
2023133,Make it Easier to Obtain Tax Credits,government_operations_general,new,,,
2023134,Save Time for Residents and State Workers with E-Signature Technology,digital_government,new,,,
2023135,Lower Call Wait Times and Reduce Reliance on Phone Calls,digital_government,new,,,
2023136,Launch “One ID for New York State” to Improve Digital Access,digital_government,new,,,
2023137,Build First-Rate Digital and Design Teams,digital_government,new,,,
