year,source_document,section_bucket,subsection,proposal_title,lead_agency,supporting_agencies,commitment_type,quantified,metric_or_target,implementation_pathway,notes,commitment_id,lead_agency_standardized,supporting_agencies_standardized,item_type_clean,implementation_pathway_clean,binary_evaluable,binary_unit,overlap_theme,status_evidence_needed,source_quality,continuity_to_prior_year,matched_prior_commitment_id,matched_prior_title,match_basis,commitment_text,source_page,source_page_end,text_capture_confidence
2022,2022StateoftheStateBook.pdf,Health care,Part I-A: Rebuild and Grow the Healthcare Workforce by 20% Over the Next Five Years,Make a $10 Billion Investment in Healthcare and Support Wages for Workers,DOH,,funding/tax/benefit,yes,$10 Billion,mixed,First-pass coding from 2022 SOTS table of contents.,2022-001,DOH,,funding/tax/benefit,executive_budget,no,,health_care_general,"budget appropriation, program awards, or fiscal documents",first_pass_toc,,,,,"New York's essential healthcare workers have seen us through a once-in-a-century public health crisis and turned our state into a model for battling - and beating - COVID-19. But many of these workers are still earning a wage far below what they need to sustain a household and a fair quality of life.

To grow New York's healthcare workforce by 20 percent over the next 5 years, we must attract talented people into the profession at a time of such significant strain. And to do that - while also retaining those who have been working so tirelessly and heroically these past two years - we must treat our healthcare workforce with the dignity they deserve.

Simply put, we must build the healthcare system of tomorrow. To do that, Governor Hochul will make more than a $10 billion, multi-year investment in healthcare, including more than $4 billion to support wages and bonuses for healthcare workers. Key components of this multi-year investment include:

• $2 billion to support healthcare worker wages. • $2 billion to support healthcare and mental hygiene worker retention bonuses, with up to $3,000 bonuses going to full-time workers who remain in their positions for one year, and pro-rated bonuses for those working fewer hours. • $500 million for Cost of Living Adjustments (COLAs) to help raise wages for human services workers. • $2 billion for healthcare capital infrastructure and improved lab capacity. • Other investments in workforce and healthcare access and delivery.

New Yorkers owe an endless debt of gratitude to our healthcare workers for all they have given us. It is time we start to repay it in a meaningful way.",23,23,high
2022,2022StateoftheStateBook.pdf,Health care,Part I-A: Rebuild and Grow the Healthcare Workforce by 20% Over the Next Five Years,Increase the Training Capacity of Medical Institutions,DOH,,staffing/workforce,no,,mixed,First-pass coding from 2022 SOTS table of contents.,2022-002,DOH,,staffing/workforce,mixed,no,,health_care_general,"implementation metrics, agency reports, or budget plus rollout evidence",first_pass_toc,,,,,"With their focus on delivering immediate care to New Yorkers, our state's medical institutions often lack the training capacity to focus on preparing the next generation of healthcare professionals. To support a steady pipeline of high-quality healthcare workers, Governor Hochul will increase the training capacity of medical institutions. This initiative will cover the costs of new programs, provide compensation to allow workers to train full-time support staff (who help free up existing staff do more training), and the development of new training techniques.",24,24,high
2022,2022StateoftheStateBook.pdf,Health care,Part I-A: Rebuild and Grow the Healthcare Workforce by 20% Over the Next Five Years,Attract Students into Healthcare by Relieving Their Financial Burdens,DOH,,other,no,,mixed,First-pass coding from 2022 SOTS table of contents.,2022-003,DOH,,other,mixed,no,,health_care_general,agency report or official implementation evidence,first_pass_toc,,,,,"The average amount of student debt amassed by a person entering the healthcare industry in the U.S. is higher than any other industry at a staggering $72,800,4 discouraging many strong would-be professionals from entering the field in the first place. Governor Hochul will provide direct financial support for the education of healthcare professionals, provided that they work in New York State for a specified period after obtaining their credentials.

Governor Hochul's plan will offer free tuition, cover instructional costs for high- demand health occupations and provide stipends to make up for lost income while in school. It would also provide for wraparound services such as childcare or transportation support to eliminate obstacles that stand in the way of New Yorkers training for healthcare professions. Together these efforts will make it easier for many more talented New Yorkers to pursue a career in healthcare - and help meet the needs of our state.",24,24,high
2022,2022StateoftheStateBook.pdf,Health care,Part I-A: Rebuild and Grow the Healthcare Workforce by 20% Over the Next Five Years,Award Prior Learning Credit across SUNY and CUNY,DOH,SUNY; CUNY,other,no,,mixed,First-pass coding from 2022 SOTS table of contents.,2022-004,DOH,SUNY; CUNY,other,mixed,no,,college_workforce_pathways,agency report or official implementation evidence,first_pass_toc,,,,,"Health and human services workers engage in significant on-the-ground learning through the direct care they provide, often before they pursue additional school training. But not every training program recognizes this work in the same way,

creating barriers to would-be professionals pursuing a health or human services career.

As part of the Governor's plan to make it easier for New Yorkers to move between college and career, the State University of New York (SUNY) and the City University of New York (CUNY) will adopt a consistent, statewide policy for crediting relevant prior learning and work experience, supporting credit accumulation, certifications, and post-secondary attainment.

While this program will benefit all students in SUNY and CUNY schools, it will be particularly meaningful for New Yorkers who have spent years working in the health and human services field and gaining invaluable experience on the job. Under this policy, it will be a far more seamless experience to return to school to gain the necessary credentials to move up the career ladder.",24,25,high
2022,2022StateoftheStateBook.pdf,Health care,Part I-A: Rebuild and Grow the Healthcare Workforce by 20% Over the Next Five Years,Recruit Medical Professionals to Work in Underserved Areas,DOH,,staffing/workforce,no,,mixed,First-pass coding from 2022 SOTS table of contents.,2022-005,DOH,,staffing/workforce,mixed,no,,health_care_general,agency report or official implementation evidence,first_pass_toc,,,,,"Governor Hochul recognizes the need to recruit medical professionals to work in underserved areas, particularly in rural parts of the state, and to ensure a diverse healthcare workforce throughout the state. To achieve these goals, New York State will:

• Increase Funding for the Doctors Across New York Program: This proposal will provide loan forgiveness up to $120,000 for doctors who work in underserved areas for three years.

• Create a ""Nurses Across NY"" Program: Based on the successful Doctors Across NY program, this proposal will place nurses in underserved areas across the state.

• Expand the SUNY Pre-Medical Opportunity Program and the Diversity in Medicine Program: These programs will recruit and train a diverse healthcare workforce that represents the diversity of the patients in underserved communities to ensure health equity across the continuum of care.",25,26,high
2022,2022StateoftheStateBook.pdf,Health care,Part I-A: Rebuild and Grow the Healthcare Workforce by 20% Over the Next Five Years,Connect Immigrant New Yorkers to Direct Support Professions,DOH,ONA,other,no,,mixed,First-pass coding from 2022 SOTS table of contents.,2022-006,DOH,ONA,other,executive_budget,no,,health_care_general,"budget appropriation, program awards, or fiscal documents",first_pass_toc,,,,,"The immigrant labor pool is often unemployed or underemployed due to the adversity faced in obtaining recognition for foreign education or credentials in the U.S. Skilled immigrant New Yorkers may have professional credentials, but a licensing board may be unable to translate foreign education to the board's requirements.

State agencies will work with external partners to develop an apprenticeship job training program that provides new and existing immigrant workers with a career pathway in the workforce - addressing the gap in immigrant employment while filling more urgently needed direct support professions.",26,26,high
2022,2022StateoftheStateBook.pdf,Health care,Part I-A: Rebuild and Grow the Healthcare Workforce by 20% Over the Next Five Years,Allow Doctors and Nurses to Easily Relocate to and Practice in New York,DOH,,other,no,,mixed,First-pass coding from 2022 SOTS table of contents.,2022-007,DOH,,other,mixed,yes,authorized,health_care_general,"executive order, agency launch, or official announcement",first_pass_toc,,,,,"Inconsistent professional licensing requirements across states can create barriers for doctors or nurses wishing to relocate to and practice in New York. To reduce these obstacles, Governor Hochul will propose legislation for New York to join the Interstate Medical Licensure Compact and the Nurse Licensure Compact. Joining these compacts will enable doctors and nurses to relocate to New York and use their existing license to more quickly be able to practice in the state through telehealth or otherwise, attracting more healthcare workers at a time of great need. This practice was temporarily allowed by Executive Order during the COVID-19 pandemic and resulted in greater availability of qualified healthcare professionals in New York.",26,26,high
2022,2022StateoftheStateBook.pdf,Health care,Part I-A: Rebuild and Grow the Healthcare Workforce by 20% Over the Next Five Years,Expand Workforce Development Partnerships to Build a Human Services Talent Pipeline,DOH,,capital/infrastructure,no,,mixed,First-pass coding from 2022 SOTS table of contents.,2022-008,DOH,,capital/infrastructure,mixed,no,,health_care_general,"implementation metrics, agency reports, or budget plus rollout evidence",first_pass_toc,,,,,"To further strengthen the human services talent pipeline, Governor Hochul will use federal funds to expand two successful workforce development programs:

• Expand the Direct Support Professional Career and Technical Education Program: Currently, the Office for People with Developmental Disabilities (OPWDD) partners with the Capital Region Boards of Cooperative Educational Services (BOCES) to offer high school students the opportunity to become direct care workers through the Direct Support Professional Career and Technical Education program. Governor Hochul will expand this successful program to other BOCES statewide and direct the human services agencies to collaborate with BOCES to establish programs for all direct care workers.

• Expand the SUNY for All Partnership with OPWDD: SUNY for All is a free training tool for direct support professionals to enhance their skills and help them enter, or advance, in the health and human services field. This proposal would expand the SUNY for All partnership to all 10 SUNY Educational Opportunity Centers statewide and create opportunities for all direct care workers.",27,27,high
2022,2022StateoftheStateBook.pdf,Health care,Part I-A: Rebuild and Grow the Healthcare Workforce by 20% Over the Next Five Years,Grow the Home and Community-Based Health Care Workforce Through Benefits and Skills Development,DOH,,staffing/workforce,no,,mixed,First-pass coding from 2022 SOTS table of contents.,2022-009,DOH,,staffing/workforce,mixed,no,,health_care_general,agency report or official implementation evidence,first_pass_toc,,,,,"The need for home healthcare workers in New York is estimated to grow by roughly 65 percent5 by 2028, the most of any healthcare occupation. The American Rescue Plan Act (ARPA) provided significant funding for states to invest in their home and community-based health care systems. Under Governor Hochul's leadership, New York State has applied to the Federal government to spend $2.2 billion on 14 initiatives to strengthen our care workforce. These include:

• Home Care Workforce Initiative: Enables home care agencies to implement evidence-based programs that help them to recruit, retain, train, and support their direct care workers.

• Workforce Transportation Incentive: Solves transportation-related barriers related to home care worker recruitment and/or retention.

• Retention Incentives for the Intellectual or Developmental Disabilities Workforce: Provides longevity and retention incentives to direct support professionals.

• Direct Support Professional Workforce Development Grants: Provides skills development for direct support professionals.

• Workforce Recruitment Initiative: Implements data-driven strategies for effective recruitment of workers for OPWDD.

• Community Residence Program: Increases funding for rising direct care staff costs.

Part I-B: Retain the Existing Healthcare Workforce

Given the tremendous and unrelenting strain on healthcare workers since the start of the pandemic, it is not hard to appreciate the challenges of workforce retention. Across healthcare nationwide, employment was down nearly 6 percent6 in November 2021, compared with where it would have been based on pre-pandemic trends. The challenge of rebuilding and growing New York's health workforce will only mount if we cannot keep talented workers on the job. To simply keep up with growing demand, prior to the pandemic, healthcare employers and providers were

adding an average of 34,000 new workers in high-demand positions (home health aides and nurses) each year, on top of the roughly 100,000 workers who needed to be recruited each year to replace those who leave their jobs.7

Governor Hochul will strengthen retention in the healthcare workforce by developing career pathways for long-term care workers, investing in mentorship and transition tools to get workers from school to professional practice, and launching programs to coordinate training, retention, and care delivery strategies across the state, among other initiatives. A central goal is to make the day-to-day job more satisfying and rational for these vital workers so they can stay in the profession and improve care for us all.",27,29,high
2022,2022StateoftheStateBook.pdf,Health care,Part I-B: Retain the Existing Healthcare Workforce,Support More Career Flexibility for Direct Care Workers,DOH,,other,no,,mixed,First-pass coding from 2022 SOTS table of contents.,2022-010,DOH,,other,mixed,no,,health_care_general,"implementation metrics, agency reports, or budget plus rollout evidence",first_pass_toc,,,,,"Long-term care workers often face barriers to moving across caregiving roles. For example, certified nursing assistants are not allowed to administer medication in long-term care facilities, even if they have sufficient training or experience. Such rules make it harder for health workers to take new jobs and make it harder for facilities to fill open roles.

This initiative will facilitate the creation of a model for training ""universal"" long- term care workers who want to move across caregiving roles, ensuring that long- term care providers experiencing extreme workforce shortages can obtain and deploy trained workers in a timely and efficient manner.",29,29,high
2022,2022StateoftheStateBook.pdf,Health care,Part I-B: Retain the Existing Healthcare Workforce,Improve Training and Coordination Between EMS Professionals Statewide,DOH,,staffing/workforce,no,,mixed,First-pass coding from 2022 SOTS table of contents.,2022-011,DOH,,staffing/workforce,mixed,no,,health_care_general,"implementation metrics, agency reports, or budget plus rollout evidence",first_pass_toc,,,,,"The COVID-19 pandemic has shown the critical need for the Emergency Medical Services (EMS) workforce to be nimble and ready to respond to public health emergencies. Based on lessons learned during the pandemic, Governor Hochul has a plan to modernize New York's EMS system and workforce. Core initiatives include:

• Developing statewide treatment protocols across EMS agencies for basic and advanced life support by a single statewide council. • Creating a coordinated statewide EMS emergency response system. • Attracting a new generation of EMS providers through new EMS educational opportunities that foster professional growth and increase the overall number of EMS personnel. • Updating the definition of ""emergency medical services"" to include new models of health care delivery such as community paramedicine, which permits EMTs to provide health services where access to physicians, clinics, and/or hospitals may be difficult.

An investment in our frontline responders is an investment in urgent care for all New Yorkers.",29,30,high
2022,2022StateoftheStateBook.pdf,Health care,Part I-B: Retain the Existing Healthcare Workforce,Reform Rules Limiting What Services Health Workers Can Provide,DOH,,other,no,,mixed,First-pass coding from 2022 SOTS table of contents.,2022-012,DOH,,other,mixed,no,,health_care_general,agency report or official implementation evidence,first_pass_toc,,,,,"Healthcare ""scope of practice"" refers to the health-related actions permitted by a worker's professional license. In September, Governor Hochul issued an Executive Order8 declaring a statewide emergency due to healthcare staffing shortages that expanded the scope of care for some professionals, enabling them to help New Yorkers in urgent need. To maintain this critical flexibility, Governor Hochul will propose legislation to make permanent the most beneficial provisions from the Executive Order, listed below, as well as others implemented during the pandemic.

Under the Governor's proposal, more professionals will be allowed to administer vaccines, flu, and COVID-19 testing; supervisory requirements in clinical laboratories will be modernized; and requirements will be waived for Nurse Practitioners to have a written practice agreement with a physician, which is an obstacle that stands in the way of Nurse Practitioners providing the maximum amount of care to New Yorkers.

New York's health workforce is filled with tremendously talented professionals who are learning more about how to battle this pandemic every day. We should leverage the growing skills of the workers already caring for New Yorkers to provide even more care when it is needed most.",30,31,high
2022,2022StateoftheStateBook.pdf,Health care,Part I-B: Retain the Existing Healthcare Workforce,Create an Office of Healthcare Workforce Innovation,DOH,,program/governance,no,,mixed,First-pass coding from 2022 SOTS table of contents.,2022-013,DOH,,program/governance,executive_action,yes,created,health_care_general,"executive order, agency launch, or official announcement",first_pass_toc,,,,,"To better coordinate statewide health and direct care workforce strategies, Governor Hochul is directing the Department of Health (DOH) to create an Office of Healthcare Workforce Innovation. This new Office will work across agencies and gather regular, organized input from health and direct care providers, educational organizations, labor unions, and other stakeholders to (1) build a workforce hub, or a statewide online portal that matches candidates with training opportunities, support services, and jobs, (2) develop approaches for strengthening the health and direct care workforce that have been implemented in other states, (3) test new models of care and new educational strategies, and (4) recommend policies to increase the supply of health care and direct support personnel and meet the demands in New York.

Part I-C: Advancing Health Equity: Expand the Reach of Our Healthcare Workforce Through Digital Innovation

The COVID-19 pandemic jumpstarted the development of telehealth and other digital health tools. In the first months of the pandemic, telehealth claims in New York State skyrocketed from being just a fraction of all commercial insurance medical claims to being nearly 17 percent.9 Nationally, telehealth claims were 38 times10 higher in February 2021 than pre-pandemic February 2020. Since the onset of the pandemic, new federal laws and policies have made it easier for people to receive medical care through telehealth paid for by Medicare, Medicaid, and the Children's Health Insurance program (CHIP).

New York is fast becoming America's digital health capital, thanks in large part to our leading healthcare sector, and is well positioned to build on the lessons learned during the pandemic to broaden the impact of digital healthcare for all New Yorkers. Telehealth and other digital services are especially important for ensuring access to specialists who are difficult to find in underserved communities, particularly upstate. This momentum also has the potential to create high-quality new jobs. In New York City alone, healthcare startups raised $7.6 billion11 just through March 2021.

To build on this success and expand the reach of our growing healthcare workforce, Governor Hochul's plan is designed to ensure that more New Yorkers can access digital health services and make these services more convenient and equitable. She will empower New Yorkers to better meet their healthcare needs and manage their healthcare costs, keeping our state at the forefront of America's digital health future.",31,32,high
2022,2022StateoftheStateBook.pdf,Health care,Part I-C: Advancing Health Equity: Expand the Reach of Our Healthcare Workforce Through,Require Private Insurers to Reimburse Appropriate Telehealth Services at the Same Levels as Traditional Services,DOH,DFS,legislation/regulation,no,,legislation_required,First-pass coding from 2022 SOTS table of contents.,2022-014,DOH,DFS,legislation/regulation,legislation_required,no,,health_care_general,agency report or official implementation evidence,first_pass_toc,,,,,"The pandemic demonstrated the inequities in our healthcare system and showed that telehealth is a critical tool to expand access to healthcare, especially for behavioral health support. During the crisis, New York saw an approximately 130- fold increase in telehealth usage. Increased telehealth usage has been demonstrated to lower health costs and improve the patient experience, including expanding access to care and improving health outcomes.

Medicaid already pays for telehealth services at the same rates as equivalent traditional services. But that isn't true for many private healthcare plans, and this limits access to these important services for many New Yorkers. Governor's Hochul will establish parity for telehealth services across commercial insurance plans and

require insurers to offer an adequate network of telehealth health care providers, expanding access for telehealth services throughout the state.

Right now, telehealth adoption is uneven across the state. In particular, telehealth is underutilized by rural populations, those over 60 years old, low-income communities, racial and ethnic minorities, and groups with limited English proficiency. These groups often face a number of barriers to accessing telehealth, and legislative reform is needed to build a more accessible, equitable, effective, and efficient healthcare system. This proposal is a critical step.

Additionally, Governor Hochul will require insurers to provide up-to-date information in their provider directories about which providers offer telehealth services, and require providers to disclose and make publicly available the telehealth services they offer - making it easier for New Yorkers to find the services they need.",32,33,high
2022,2022StateoftheStateBook.pdf,Health care,Part I-C: Advancing Health Equity: Expand the Reach of Our Healthcare Workforce Through,Create Powerful Patient and Provider Information Tools,DOH,,program/governance,no,,mixed,First-pass coding from 2022 SOTS table of contents.,2022-015,DOH,,program/governance,executive_action,yes,created,health_care_general,"executive order, agency launch, or official announcement",first_pass_toc,,,,,"Telehealth and other digital health services continue to expand the amount and type of information they put directly into the hands of New Yorkers, but there is still room to improve access to digital healthcare information.

To create stronger patient and provider information tools, Governor Hochul will establish partnerships between New York State and digital health companies to provide patients with their own health information through familiar formats, such as mobile health apps. This will enable more New Yorkers - especially those who have historically been underserved - to actively manage their own care.",33,33,high
