year,source_document,section_bucket,subsection,proposal_title,lead_agency,supporting_agencies,commitment_type,quantified,metric_or_target,implementation_pathway,notes,commitment_id,lead_agency_standardized,supporting_agencies_standardized,item_type_clean,implementation_pathway_clean,binary_evaluable,binary_unit,overlap_theme,status_evidence_needed,source_quality,continuity_to_prior_year,matched_prior_commitment_id,matched_prior_title,match_basis,commitment_text,source_page,source_page_end,text_capture_confidence
2023,2023SOTSBook.pdf,Transportation / infrastructure,Part IV-C: Prepare For Future Emergencies,Move Forward on Light Rail Option for the Interborough Express,Department of Transportation,,other,no,,mixed,First-pass coding from 2023 SOTS table of contents.,2023-121,DOT,,other,mixed,no,,mta_service_and_finance,agency report or official implementation evidence,cleaned_toc_pass,follow_on,2022-113,Advance the Transformative “Interborough Express” to Enhance Regional Mobility and Serve Nearly 1 Million New Yorkers,"theme=mta_service_and_finance; shared_terms=express, interborough","Governor Hochul's Interborough Express (IBX) will create a new transit connection between Brooklyn and Queens, taking advantage of an existing underutilized freight rail right-of-way that runs from Sunset Park to Jackson Heights. Upon construction, IBX will slash travel times between the two boroughs, cut congestion, and expand economic opportunities for the people who live and work in the surrounding neighborhoods.

The Interborough Express planning and environmental linkages study recommends light rail as the preferred option for providing fast, frequent service, connecting the Interborough with up to 17 different subway lines and the Long Island Railroad. Over the coming months, Governor Hochul and the MTA will work to complete the environmental review in order to ensure the IBX's inclusion in the MTA's next Five Year Capital Plan.",225,225,high
2023,2023SOTSBook.pdf,Transportation / infrastructure,Part IV-C: Prepare For Future Emergencies,Expand EV Charging Infrastructure,Department of Transportation,,program/policy,no,,mixed,First-pass coding from 2023 SOTS table of contents.,2023-122,DOT,,program/policy,mixed,no,,transport_electrification,"implementation metrics, agency reports, or budget plus rollout evidence",cleaned_toc_pass,new,,,,"Electric vehicles have seen rapid adoption across the U.S., skyrocketing from around 280,300 electric cars

registered in 2016 to approximately 1. million in 2021. However, New York ranks just 29th in the nation for electric vehicles per capita, far behind our peers, including California and Washington D.C. Public charging infrastructure is critical to meet demand and spur new investment in electric vehicles.

The transportation sector accounts for nearly half (47 percent) of the state's current greenhouse gas emissions, and much of that comes from cars and light duty trucks. To continue addressing the need to decrease these dangerous emissions, New York State will receive $175 million over five years in federal funds to establish an interconnected network of reliable charging for electric vehicles, which incentivizes EV purchasing. Under Governor Hochul's leadership over the next year, New York will continue to work with agency partners and other stakeholders to determine the most efficient and effective way to provide incentives that support the installation, operation, and maintenance of infrastructure to continue leading the transition to 100 percent zero-emission on-road vehicles. These funds will be used to invest in charging infrastructure, which will be built within one travel mile

of designated EV corridors, with charging stations no more than 50 miles apart.

New York will build out its charging station network on 1,787 centerline miles of interstate highways and 290 centerline miles of state highways within the state's EV Alternative Fuel Corridor. Corridors will include many of the state's most-traveled interstate and state highways, including the Thruway, Northway, and other major roadways.",225,227,high
2023,2023SOTSBook.pdf,Transportation / infrastructure,Part IV-C: Prepare For Future Emergencies,Improve Bus Reliability,Department of Transportation,,program/policy,no,,mixed,First-pass coding from 2023 SOTS table of contents.,2023-123,DOT,,program/policy,mixed,no,,transportation_general,"implementation metrics, agency reports, or budget plus rollout evidence",cleaned_toc_pass,new,,,,"Buses should be speedy and reliable, but too often the actions of other drivers can disrupt service and pose real threats to passenger safety. From illegally blocking bus stops to impeding traffic in bus lanes, cars failing to follow the law impose real burdens on bus riders trying to get to their destination. To help speed up our bus network and drastically improve commuter experiences, Governor Hochul is directing the MTA to install Automated Bus Lane Enforcement (ABLE) cameras on 900 buses. This investment builds on work the MTA has done to install cameras on 123 buses,

which have already resulted in fewer of the illegally parked vehicles that slow down bus trips. With the additional cameras, 80 percent of bus lanes will be covered - vastly increasing the dependability of buses and reducing travel times by discouraging illegal parking in bus lanes.

Governor Hochul will also seek to make the law permanent and expand it to allow the cameras to enforce all New York City traffic rules in bus lanes.",227,228,high
2023,2023SOTSBook.pdf,Transportation / infrastructure,Part IV-C: Prepare For Future Emergencies,Allow New York City to Lower Its Speed Limit,Department of Transportation,,other,no,,mixed,First-pass coding from 2023 SOTS table of contents.,2023-124,DOT,,other,legislation_required,yes,authorized,street_safety,"executive order, agency launch, or official announcement",cleaned_toc_pass,new,,,,"Governor Hochul is committed to making New York the safest state in the country for pedestrians, cyclists, and drivers alike. Tragically, research demonstrates that many of the collisions and fatalities that occur on the roads are preventable through better policies that prioritize safety over speed and encourage smarter, safer driving.

To better allow New York City to adjust its speed limit to account for the dangers of fast driving in urban environments, Governor Hochul is introducing legislation to ease state restrictions in State law that

prevent the lowering of the citywide speed limit below 25 miles per hour and the City's school speed limit below 15 miles per hour. Giving New York City the autonomy to change its speed limit can help the City determine how best to safeguard its own streets.",228,229,high
2023,2023SOTSBook.pdf,Transportation / infrastructure,Part IV-C: Prepare For Future Emergencies,Spur Transportation Innovation Upstate,Department of Transportation,,other,no,,mixed,First-pass coding from 2023 SOTS table of contents.,2023-125,DOT,,other,mixed,no,,transportation_general,agency report or official implementation evidence,cleaned_toc_pass,new,,,,"Access to public transportation provides measurable and immeasurable benefits to communities. To help more New Yorkers get where they need to go, Governor Hochul will launch a new program to expand access to public transit in upstate and non-MTA-accessible communities.

Governor Hochul's Innovative Mobility Initiative will provide funding for public transportation services for riders facing barriers to traditional public transit and for the creation of new options in locations currently without transit. The initiative will provide funding for a five year pilot program, allocating $1 million to each of the seven largest non-MTA systems, while smaller systems throughout the state would jointly be eligible for a competitive fund of $3 million. Awardees can use

funds to: serve as a 20 percent match for federal funds; purchase technology that enables a local app-enabled trip request and fare payment structure for public transit; purchase smaller vehicles; and otherwise create a transit service that suits local needs. The initiative would encourage innovation and flexibility in service of equity, accessibility, reduced costs, and better environmental outcomes.",229,230,high
2023,2023SOTSBook.pdf,Transportation / infrastructure,Part IV-C: Prepare For Future Emergencies,Take High Risk Drivers Off the Road,Department of Transportation,,other,no,,mixed,First-pass coding from 2023 SOTS table of contents.,2023-126,DOT,,program/policy,mixed,no,,street_safety,agency report or official implementation evidence,cleaned_toc_pass,new,,,,"Increasing road safety requires a multipronged approach to end high-risk driving that endangers everyone on the road. Governor Hochul will direct the Department of Motor Vehicles to amend regulations to increase the number of points associated with dangerous driving and decrease the threshold at which dangerous drivers are disqualified from holding a license. She will also direct the DMV to amend regulations to lower the bar for permanent license forfeiture for reckless drivers who continue to drive under the influence of mind-altering substances. Collectively, these changes would reduce the number of

high-risk driving incidents by taking persistently dangerous drivers off the road.",230,231,high
2023,2023SOTSBook.pdf,Transportation / infrastructure,Part IV-C: Prepare For Future Emergencies,Empower The Department of Transportation to Seize Dangerous Vehicles,Department of Transportation,,other,no,,mixed,First-pass coding from 2023 SOTS table of contents.,2023-127,DOT,,other,mixed,no,,street_safety,agency report or official implementation evidence,cleaned_toc_pass,new,,,,"The Department of Transportation (DOT) is charged with helping to ensure safety on the roads. However, though DOT can effectively regulate stretch limousines, the agency is not able to suspend, seize, and impound other dangerous large passenger vehicles like vans, ambulettes, motor coaches, buses, and party buses. There are more than 62,000 such vehicles within New York State, and their operation can carry additional safety risks. Governor Hochul will propose legislation to make this change and give DOT the added capacity to ensure safer roads.",231,231,high
2023,2023SOTSBook.pdf,Transportation / infrastructure,Part IV-C: Prepare For Future Emergencies,Stop Secondary Crashes,Department of Transportation,,other,no,,mixed,First-pass coding from 2023 SOTS table of contents.,2023-128,DOT,,other,mixed,no,,street_safety,agency report or official implementation evidence,cleaned_toc_pass,new,,,,"The longer a traffic accident or dangerous incident remains on the roadway, the more likely there is to be a secondary incident, increasing the risk of death or

serious personal injury to the public and emergency responders. Governor Hochul will propose legislation to require drivers of a vehicle involved in an accident with no personal injury to move their vehicle to a safe location and clear the travel lanes in a safe and timely manner. This would reduce the likelihood of secondary crashes. Reducing the congestion caused by minor crashes will also help to avoid unnecessary motorist delays and adverse environmental effects.",231,232,high
2023,2023SOTSBook.pdf,Transportation / infrastructure,Part IV-C: Prepare For Future Emergencies,Close the DWI Loophole,Department of Transportation,,other,no,,mixed,First-pass coding from 2023 SOTS table of contents.,2023-129,DOT,,other,legislation_required,no,,street_safety,agency report or official implementation evidence,cleaned_toc_pass,new,,,,"Since the passage of Vince's Law in 2014, the Vehicle and Traffic Law has imposed strict penalties on drivers convicted of three or more convictions of Driving Under the Influence (DWIs) within 15 years, and provided that a person twice convicted of a DWI where personal injury has occurred cannot be relicensed. However, not all incidents where personal injury has occurred are included in the law, leaving a loophole where certain instances of DWI are treated with more leniency than others, even when they involve substantially similar conduct and similarly injurious results. New York will amend the law to ensure that all persons twice

convicted of a DWI where personal injury has occurred cannot be relicensed, thereby removing some of the state's most dangerous drivers from the road.

SECTION XIII: IMPROVING STATE GOVERNMENT: THE CUSTOMER EXPERIENCE

New Yorkers deserve a government that works, one that provides services that are as fast, seamless, and efficient as what we experience as consumers in the rest of our daily lives. Unfortunately, New Yorkers commonly experience significant bureaucratic friction when seeking to obtain benefits and services from the state government - whether filing for unemployment insurance, getting a driver's license renewed, filing taxes, or signing up for benefits programs.

This friction can take many forms. These processes might require residents to take time off work to attend in-person appointments, parse through lengthy applications and verbose websites, or wait weeks for back-office processing before receiving their benefits.

These administrative burdens amount to a ""time tax"" on New Yorkers, which can detract from the rest of their lives and leave them feeling disempowered, frustrated,

and cynical about their government and elected officials. Worst of all, this ""time tax"" can even serve as

a barrier standing in the way of low-income New Yorkers being able to participate in critical safety net services that have been proven to lift families out of poverty. Eligible New Yorkers who are unable to navigate these bureaucratic hurdles might decline or miss out on child care assistance, food assistance programs, and tax relief. Less than 10 percent of families meeting the income requirements take advantage of child care assistance, and enrollment has declined over the past 10 years despite increased funding. (It is important to note, however, that Governor Hochul and the Legislature expanded eligibility in the Fiscal Year 2023 budget, and the total number of children participating in the State's child care program grew by 19 percent from January to September 2022.)

Even when residents receive the support to which they are entitled, the eligibility determination process can delay access to their benefits. It often takes weeks and multiple in-person appointments before individuals applying to certain anti-poverty programs receive an

eligibility determination. This problem was exacerbated by the pandemic, when government programs across the country struggled to keep up with increased demand.

While some of these sorts of government inefficiencies are common across the U.S., others are particular to New York. A recent national survey ranked New York in the bottom quarter of states in customer experience. 103

Respondents ranked New York State services below unpopular stalwarts such as cable television companies, electric utilities, and airlines. Even car insurance companies outranked our state in satisfying customers.

Governor Hochul is committed to making government customer-centered. She is proposing a series of initiatives that will put the experience of New Yorkers at the center of both policy and service delivery, leading to faster processing times and greater efficiency, along with significant improvements in residents' interactions with government. In the long-term, this will increase public trust, drive rates of participation in public programs, and save taxpayer money by lowering administrative expenses.",232,236,high
2023,2023SOTSBook.pdf,Government operations / customer experience,Part IV-C: Prepare For Future Emergencies,Make Customer Experience and Benefits Participation a State Priority,Office of Information Technology Services,,other,no,,mixed,First-pass coding from 2023 SOTS table of contents.,2023-130,Office of Information Technology Services,,other,mixed,no,,digital_government,agency report or official implementation evidence,cleaned_toc_pass,new,,,,"Every day, millions of New Yorkers interact with a service provided by New York State government, whether that be commuting to work, using food assistance to feed their families, or exploring a state park. These day-to-day interactions define your experience of your government and its leaders.

And yet, like many government entities across the country, most New York State agencies do not have metrics or goals related to customer experience (CX). Many benefits programs do not measure the administrative burden imposed on New Yorkers who are seeking services, or set goals related to reducing those burdens. If New York State aspires to be one of the most equitable and customer-friendly state governments in the nation, we must commit to making customer experience a priority.

In recent years, the federal government has committed to the same cause. In December 2021, President Biden signed an Executive Order on ""Transforming Federal Customer Experience and Service Delivery to Rebuild Trust in Government."" This order enshrined the

federal government's commitment to CX in law and laid out 36 specific priorities aimed at making government interactions less burdensome, including an emphasis on putting people at the center of everything the federal government does.

Governor Hochul will sign New York's first Executive Order on customer experience, creating a statewide action plan to direct agencies to begin collecting data on the delivery of services in New York State, setting performance targets to reduce the ""time tax"" on residents, and establishing a regular process to review progress. She will also direct agencies to study and improve access to services, including taking steps to make it easier for beneficiaries of one benefits program to enroll in other programs. In order to ensure that this initiative is successful, Governor Hochul will appoint a Chief Customer Experience Officer to oversee this statewide transformation.

Complementing the Executive Order, the Executive Chamber and Division of the Budget will lead the development of a statewide guidebook identifying the key principles and objectives for delivering premiere service to all New Yorkers.

Through these initiatives, Governor Hochul will increase access to benefits and improve the customer experience New York State provides.",237,239,high
2023,2023SOTSBook.pdf,Government operations / customer experience,Part IV-C: Prepare For Future Emergencies,Simplify the Child Care Assistance Application Process,Office of Information Technology Services,,other,no,,mixed,First-pass coding from 2023 SOTS table of contents.,2023-131,Office of Information Technology Services,,other,executive_action,no,,child_care_access,agency report or official implementation evidence,cleaned_toc_pass,new,,,,"New Yorkers can often find themselves attempting to navigate confusing processes when seeking to obtain benefits and services from their government. New York's Child Care Assistance Program (CCAP) is no exception. Currently, the program is state-supervised and locally administered. This means residents must navigate different eligibility requirements depending on where they live and are required to apply for benefits through their local social service district.

To add to this confusion: as of January 2022, only three of 58 county websites provide clear instructions on applying for child care benefits, including detailed information on eligibility requirements to help parents decide whether to apply, as well as an application available for download .105

This administrative burden means families get lost in the process and do not receive the assistance they need. Less than 10 percent of families meeting the income requirements to partake in the child care assistance program are doing so, a clear sign that the program is not reaching all eligible families. Enrollment has declined over the past 10 years despite an increase in funding, and a recent survey indicates that 76 percent of parents in New York State are concerned about a lack of affordable child care.106

Governor Hochul will take a client-centered approach to modernizing CCAP, by simplifying the documentation process for applying for child care and standardizing eligibility and benefits across local social service districts. The Governor will also launch a statewide electronic solution that will allow families to pre-screen for eligibility and apply for child care assistance. Furthermore, the State's plan will make it far easier to determine eligibility for child care assistance for families receiving Medicaid and other programs by simplifying the application process and removing duplicative paperwork. Through these initiatives, along with those discussed in the section entitled ""Reducing

Administrative Barriers to Accessing Quality Child Care,"" New York State will dramatically increase the number of eligible families who access state child care assistance, and the total number of children who will benefit.",239,241,high
2023,2023SOTSBook.pdf,Government operations / customer experience,Part IV-C: Prepare For Future Emergencies,"Improve the Client Experience of Food Benefits for Women, Infants and Children",Office of Information Technology Services,,program/policy,no,,mixed,First-pass coding from 2023 SOTS table of contents.,2023-132,Office of Information Technology Services,,program/policy,mixed,no,,government_operations_general,"implementation metrics, agency reports, or budget plus rollout evidence",cleaned_toc_pass,new,,,,"Only about half of the eligible families in New York participate in the Special Supplemental Nutrition Program for Women, Infants, and Children (WIC). Additionally, even WIC-enrolled families do not consistently make use of the program: nearly 10 percent do not redeem any of their food benefits, and only 81 percent of the cash value benefit for fruits and vegetables is redeemed each month. Administrative processes are known to be burdensome on mothers and families, but it is difficult to know exactly why clients are refraining from redeeming all of their benefits without seeking feedback from New Yorkers themselves.

A focus on client feedback will lead to improvements in the WIC client experience. Governor Hochul will

improve the delivery of WIC services by implementing new ways of gathering WIC client feedback through live chat, email, text, and surveys, and acting on that feedback to provide WIC services that are informed by and work for all New Yorkers.",241,242,high
2023,2023SOTSBook.pdf,Government operations / customer experience,Part IV-C: Prepare For Future Emergencies,Make it Easier to Obtain Tax Credits,Office of Information Technology Services,,funding/tax/benefit,no,,executive_budget,First-pass coding from 2023 SOTS table of contents.,2023-133,Office of Information Technology Services,,funding/tax/benefit,executive_budget,no,,government_operations_general,"budget appropriation, program awards, or fiscal documents",cleaned_toc_pass,new,,,,"Administrative burdens in government programs can result in New Yorkers leaving money on the table, particularly when it comes to tax credits and refunds.

Each year, between six percent and 18 percent of New Yorkers who are eligible for the State's Earned Income Tax Credit, and at least four percent of those who are eligible for the Empire State Child Credit (ESCC), do not receive it because they do not claim the credits despite being eligible. This leaves at least $45 million undistributed annually.

Outdated methods of communication between residents and the Department of Taxation and Finance (DTF) can also lead to delays, confusion, and missed refunds. DTF sends 830,000 School Tax Relief (STAR) checks through the mail each year to eligible homeowners. In 2021,

17,000 of these checks were not deposited, either because they were damaged, lost, or forgotten. Additionally, last year, DTF mailed more than 400,000 physical letters to residents asking for documentation to verify information reported on their tax returns. Only 37 percent of recipients responded on time, resulting in potential bills or refund adjustments.

Governor Hochul is proposing to improve the customer experience of DTF by implementing a ""mobile document upload"" to enable taxpayers to respond to DTF requests by uploading documentation on their phones, reducing reliance on snail mail, and improving on-time response rate from 37 percent to 50 percent. The Governor's plan will also implement direct deposit capability for STAR credits to reduce the need to mail paper checks to beneficiaries and expedite the process of getting payments to homeowners by about five days. The Department of Finance - and by extension, taxpayers themselves - will save $200,000 per year in expenses associated with mailing paper checks. Collectively, these proposals will ensure that more New Yorkers receive the financial assistance they and their families need.",242,243,high
