year,source_document,section_bucket,subsection,proposal_title,lead_agency,supporting_agencies,commitment_type,quantified,metric_or_target,implementation_pathway,notes,commitment_id,lead_agency_standardized,supporting_agencies_standardized,item_type_clean,implementation_pathway_clean,binary_evaluable,binary_unit,overlap_theme,status_evidence_needed,source_quality,continuity_to_prior_year,matched_prior_commitment_id,matched_prior_title,match_basis,commitment_text,source_page,source_page_end,text_capture_confidence
2023,2023SOTSBook.pdf,Schools / higher education,Part IV-C: Prepare For Future Emergencies,Continue Major Commitment to Prekindergarten Expansion,State Education Department,,other,no,,mixed,First-pass coding from 2023 SOTS table of contents.,2023-068,SED,,other,mixed,no,,public_education_funding,agency report or official implementation evidence,cleaned_toc_pass,continuation,2022-180,Provide Schools with Billions of Dollars by Fully Funding Foundation Aid,theme=public_education_funding; shared_terms=,"Research shows that children who participate in high- quality early childhood education programs demonstrate higher literacy, language, and math skills by the time they enter kindergarten. Longer-term,

prekindergarten graduates are more likely to graduate high school on time and attend college, and are less likely to be suspended or experience juvenile incarceration.84

Governor Hochul is doubling down on the State's investments in early childhood education in order to move New York closer to truly universal prekindergarten. Last year, Governor Hochul invested $125 million to expand high-quality, full-day prekindergarten. This year, she will add another $125 million, benefiting approximately 17,500 additional 4- year-old children and their families and bringing the State's total annual investment in high-quality prekindergarten to $1. billion. With this funding, the state will be roughly 95 percent phased-in with full universal prekindergarten coverage for 4-year-old children.",153,154,high
2023,2023SOTSBook.pdf,Schools / higher education,Part IV-C: Prepare For Future Emergencies,Establish High-Impact Tutoring Programs Across the State to Address Learning Loss,State Education Department,,program/governance,no,,mixed,First-pass coding from 2023 SOTS table of contents.,2023-069,SED,,program/governance,executive_action,yes,established,tutoring_learning_loss,"executive order, agency launch, or official announcement",cleaned_toc_pass,new,,,,"When Governor Hochul took office on August 24, 2021, she made sure students were back in school two weeks later. Unfortunately, the damage of the prior two school years had set many students back significantly.

The effects of the pandemic on student learning were particularly acute in New York. According to the

National Assessment of Educational Progress (NAEP), the percentage of fourth-grade students in New York performing at or above basic proficiency levels dropped 10 percentage points in math (from 76 percent to 66 percent) and eight percentage points in reading (from 66 percent to 58 percent), a larger drop than the national average. We can and must reverse this trend.

One of the interventions that has proven most consistently effective in helping students get back on track and meaningfully increasing academic achievement is known as ""high-impact tutoring."" Each student being served receives tutoring multiple times per week for an extended period of time from an assigned, dedicated tutor. Effective programs deliver increased instructional time and customized student learning, and establish meaningful relationships between tutors and students. A meta-analysis of studies found that, on average, tutoring increased achievement by the equivalent of three to 15 months of additional regular learning.85

Governor Hochul is determined to get our students back on track. That's why she will dedicate $250 million of the historic increase in Foundation Aid to the

establishment of high-impact tutoring programs in districts across the state. The programs will be established by school districts, either in-house or in partnership with external providers, and focus on assisting students in reading and math in grades 3-8.",154,156,high
2023,2023SOTSBook.pdf,Schools / higher education,Part IV-C: Prepare For Future Emergencies,Create New Early College High School and P-TECH Programs,State Education Department,SUNY,program/governance,no,,mixed,First-pass coding from 2023 SOTS table of contents.,2023-070,SED,SUNY,program/governance,executive_action,yes,created,college_workforce_pathways,"executive order, agency launch, or official announcement",cleaned_toc_pass,continuation,2022-187,Provide Tuition-Free Workforce Credential Programs at Community Colleges for High-Demand Fields,"theme=college_workforce_pathways; shared_terms=high, programs","College-level courses provided in high schools, such as those provided in early college high school and Pathways in Technology Early College High School (P- TECH) programs, allow students to earn college credits in high school, helping them get a head start on college, reduce their student debt, and prepare them for a career. To encourage the growth of these programs across the state, Governor Hochul will establish a new, $20 million grant program to support the establishment of new early college high school and P-TECH programs.

New funding will be targeted at school districts and institutions of higher education, working with industry partners to inform the design of their programs. With an eye toward the technology jobs of the present and

future - including the tens of thousands of jobs that will be created in Central New York as a result of the Micron project - programs focused on computer science and computer and software engineering pathways will be prioritized, as will programs serving students in high-need school districts.",156,157,high
2023,2023SOTSBook.pdf,Schools / higher education,Part IV-C: Prepare For Future Emergencies,Create a Robust High School-College-Workforce Pipeline,State Education Department,SUNY,program/governance,no,,mixed,First-pass coding from 2023 SOTS table of contents.,2023-071,SED,SUNY,program/governance,executive_action,yes,created,college_workforce_pathways,"executive order, agency launch, or official announcement",cleaned_toc_pass,continuation,2022-187,Provide Tuition-Free Workforce Credential Programs at Community Colleges for High-Demand Fields,"theme=college_workforce_pathways; shared_terms=high, workforce","To build the economy of the future, and to ensure the goals of education and workforce are aligned across the state, Governor Hochul will invest $10 million over two years in competitive funding for school districts, Boards of Cooperative Educational Services (BOCES), and community colleges - working in collaboration with local industry - to develop strategic workforce plans that promote job readiness in their local economies. Awards will be made in every Regional Economic Development Council (REDC) region of the state, and winning plans will receive multi-year seed funding to align industry needs throughout high school and college sequences. With this funding, New York will ensure it

remains at the forefront of workforce preparedness while meeting the local needs of industry.",157,158,high
2023,2023SOTSBook.pdf,Schools / higher education,Part IV-C: Prepare For Future Emergencies,Directly Admit All New York Students to Their Local Community Colleges,State Education Department,SUNY,other,no,,mixed,First-pass coding from 2023 SOTS table of contents.,2023-072,SED,SUNY,other,mixed,yes,implemented,college_workforce_pathways,"executive order, agency launch, or official announcement",cleaned_toc_pass,continuation,2022-187,Provide Tuition-Free Workforce Credential Programs at Community Colleges for High-Demand Fields,"theme=college_workforce_pathways; shared_terms=colleges, community","SUNY will partner with school districts so that all graduating high school seniors are accepted into their local community college, removing any barrier for high school graduates to postsecondary education.",158,158,high
2023,2023SOTSBook.pdf,Schools / higher education,Part IV-C: Prepare For Future Emergencies,Initiate a Cascading Admissions Pilot to Ensure That Every Student Has a Place at SUNY,SUNY,,program/governance,no,,mixed,First-pass coding from 2023 SOTS table of contents.,2023-073,SUNY,,program/governance,mixed,no,,college_workforce_pathways,agency report or official implementation evidence,cleaned_toc_pass,continuation,2022-188,Provide Childcare at All SUNY/CUNY Campuses,theme=college_workforce_pathways; shared_terms=suny,"SUNY will initiate a pilot project to link the admissions processes of different campuses so that students who are not accepted at a specific school are automatically considered for admission at other institutions. This will have the effect of increasing opportunities for students to attend a SUNY school and, in turn, ensure that all New York students have access to a local and affordable higher education option.",158,158,high
2023,2023SOTSBook.pdf,Schools / higher education,Part IV-C: Prepare For Future Emergencies,Provide for Reasonable Tuition Flexibility Throughout CUNY and SUNY,SUNY,,funding/tax/benefit,no,,executive_budget,First-pass coding from 2023 SOTS table of contents.,2023-074,SUNY,,funding/tax/benefit,executive_budget,no,,college_workforce_pathways,agency report or official implementation evidence,cleaned_toc_pass,continuation,2022-188,Provide Childcare at All SUNY/CUNY Campuses,"theme=college_workforce_pathways; shared_terms=cuny, suny","To ensure that institutions of higher learning at both the State University of New York and the City University of New York (CUNY) can reliably invest in their long-term futures as costs rise, while prioritizing the evolving needs of students, ensuring academic excellence, and continuing to maintain low-cost and stable tuition rates for in-state residents, Governor Hochul will propose to authorize modest annual tuition increases for both SUNY and CUNY indexed to the lesser of the Higher Education Price Index (HEPI) or three percent. And to allow SUNY's university centers to realize their potential as leading research institutions, Governor Hochul proposes phasing-in tuition flexibility for SUNY's university centers, allowing tuitions at those campuses to rise six percentage points above SUNY's base tuition rate each year for the next five years (capped at 30 percent above the base rate) for in-state students.",159,159,high
2023,2023SOTSBook.pdf,Schools / higher education,Part IV-C: Prepare For Future Emergencies,Establish a State Matching Fund for Endowment Contributions,State Education Department,,program/governance,no,,mixed,First-pass coding from 2023 SOTS table of contents.,2023-075,SED,,program/governance,executive_action,yes,established,education_general,"executive order, agency launch, or official announcement",cleaned_toc_pass,continuation,2022-178,Fund New Cohorts of the Master Teacher Program,theme=education_general; shared_terms=fund,"Endowments provide perpetual, stable, and long-term funding in support of campus operations, student scholarships for a diverse student body, endowed professorships to attract world-class faculty, innovative research, and the development of new academic fields. The nation's leading research institutions have large endowments, and so, too, should SUNY's University Centers. Governor Hochul will create the first-ever New York State matching fund for contributions made to the endowments of SUNY's four University Centers: Buffalo, Binghamton, Albany, and Stony Brook. The fund will provide $1 in State funds for every $2 contributed to university endowments, up to $500 million in State funds.",160,160,high
2023,2023SOTSBook.pdf,Schools / higher education,Part IV-C: Prepare For Future Emergencies,Provide Funding for SUNY’s Transformation,SUNY,,funding/tax/benefit,no,,executive_budget,First-pass coding from 2023 SOTS table of contents.,2023-076,SUNY,,funding/tax/benefit,executive_budget,no,,college_workforce_pathways,"budget appropriation, program awards, or fiscal documents",cleaned_toc_pass,continuation,2022-188,Provide Childcare at All SUNY/CUNY Campuses,theme=college_workforce_pathways; shared_terms=suny,"Governor Hochul will invest $200 million in digital transformation and IT infrastructure across the SUNY system. These funds will be used in part to improve systems serving students to create a seamless and

intuitive experience buoyed by world-class technology. She will also provide a one time investment of $75 million for transformational initiatives at campuses that support innovation, help meet the workforce needs of the future, and provide needed support to students. Governor Hochul will commit $200 million in capital funding in this year's budget to research labs at SUNY's flagship institutions, Stony Brook University and the University at Buffalo, to invest in new and renovated research buildings, laboratories, and state-of-the art instrumentation.

SECTION VIII: ATTRACTING AND GROWING NEW YORK STATE BUSINESSES New York has the third largest economy in the United States. Our financial, cultural, high technology, and tourism sectors are the envy of the world. However, the pandemic delivered a swift and harsh blow to New York's economy, subtracting nearly 2 million private sector jobs from the state in just three months in early 2020. We have almost fully recovered after nearly

three years of steady employment growth, with approximately 85 percent of jobs having returned. In87

response to the challenges brought on by the pandemic, Governor Hochul took a wide range of actions to revitalize the state's economy, from a $1 billion small business rescue package - on top of $800 million in small business recovery grants - and a new Office of Strategic Workforce Development aimed at putting New Yorkers to work in growing sectors, to the passage of the transformative Green Creating Helpful Incentives to Produce Semiconductors (CHIPS) legislation that was

key to landing Micron's $100 billion investment in semiconductor manufacturing in Central New York - one of the largest economic development projects in U.S. history.

Governor Hochul also committed $200 million in investment to prepare shovel-ready sites to keep New York competitive and ready for private investment, created a $25 million Digital Game Development tax credit to grow the innovative gaming industry, and streamlined the state's eight business accelerator competitions, which provide a platform for entrepreneurs from all over the world to seek venture investments, grow their innovative companies, and create technologies of the future right here in New York. In August 2022, Governor Hochul also announced a new venture competition in Long Island focused on the life sciences sector.

Key to advancing the state's economy is investment in growth sectors that offer quality jobs, including high- technology, semiconductor manufacturing, and life sciences. Between 2010 and 2021, 113,000 high-wage

jobs were created in the tech sector, encompassing everything from scientific research to software

development. Outside of the San Francisco Bay Area, New York City is the strongest hub of tech businesses, and New York's businesses were the recipients of $53 billion in venture capital in 2021. Upstate New York is becoming a hub for innovation and is poised for future investment. In the first half of 2022 alone, upstate drew more than $117 million from venture investors, resulting in approximately 500 new, high-paying jobs. 89

Strategic investments in high technology, including research and development, can bolster these high- growth industries. The semiconductor industry is thriving in New York, with more than 76 semiconductor and electronics manufacturing establishments in the state, resulting in almost $5 billion in economic impact that supports more than 343,000 good-paying jobs.

New York is leading the way to create jobs of the future. From the growth of the semiconductor industry upstate, to being a national leader in high-tech employment, New York is where new ideas and new companies are born. In 2023, Governor Hochul will further the state's economic development by focusing on industries that create innovative, quality jobs of tomorrow -

attracting new businesses to the state and helping those already here to prosper and grow.",160,165,high
2023,2023SOTSBook.pdf,Economic development / business,Part IV-C: Prepare For Future Emergencies,Modernize and Streamline the State’s Training and Employment Infrastructure,Empire State Development,Department of Labor,legislation/regulation,no,,legislation_required,First-pass coding from 2023 SOTS table of contents.,2023-077,Empire State Development,DOL,legislation/regulation,legislation_required,no,,economic_development_general,agency report or official implementation evidence,cleaned_toc_pass,new,,,,"As New York's economy returns to normal, one factor hindering a full recovery is the ongoing mismatch between the skills needed by employers and those in the incumbent workforce. Businesses of all sizes are looking to hire for a diverse range of roles but report they simply cannot find the talent to do so. This is partially due to population loss during and after the pandemic. At the same time, an increasing number of workers are neither unemployed nor seeking jobs - they've simply left the labor market. Within the remaining labor force, there is a lack of both technical and general professional skills sought by employers in industries that are producing high-quality, family- sustaining jobs.

Approximately 40 percent of New Yorkers 25 years of age or older have a high school diploma, or did not graduate high school at all. Only about 37 percent of

New Yorkers are trained for positions requiring ""professional skills,"" which makes it little surprise that

approximately half of employers cite a lack of qualified candidates as a key reason why roles are difficult to fill.92

This sentiment is echoed by job seekers, a large segment of whom cite the lack of skills, education, training, and degrees or credentials as a key barrier to employment. There are about 1. openings for every

job seeker in New York, with the positions remaining open because of a mismatch in education requirements, lack of professional skills, and lack of training or opportunity for advancement.

Fortunately, New York State has several new and established tools at its disposal to deliver skills training at scale, provide job-seeking support to unemployed and underemployed New Yorkers, and ensure a streamlined pipeline from career exploration to employment. For example, New York's Career Center network, overseen by the Department of Labor (DOL), serves more than 500,000 New Yorkers each year, while SUNY Educational Opportunity Centers (EOCs) play a major role in eliminating barriers to job training and

skill development by providing individuals with tuition- free programming.

Governor Hochul will transform DOL Career Centers into ""Community Training and Career Centers,"" with additional professional skills trainers that provide unemployed and underemployed New Yorkers with no- cost training in high-need areas such as digital and financial literacy and entrepreneurship. This will be paired with a new, large-scale, on-the-job training program administered by the DOL to upskill 3,000 workers each year, focusing on high-demand industries and hard-to-fill job titles. New York State will also retool the outdated CareerZone platform to specifically help youth, young adults, and digital literacy learners explore career paths and develop baseline professional skills required by employers from all sectors.

To further streamline and grow the workforce development pipeline, Governor Hochul is directing DOL and SUNY to establish new and innovative partnerships between Career Centers and EOCs. Leveraging each asset's unique strengths, this integrated approach will allow New Yorkers to seamlessly access a wide spectrum of job preparedness

services at no cost. This will enhance the proven DOL Career Center model while supplementing its services with SUNY's robust training arm, which can pivot in real-time to best meet the needs of businesses and provide immediate access to tuition-free training for job seekers.

Under this new model, DOL and SUNY will explore a wide range of strategies to ensure a continuum of services to job seekers and improve employment outcomes. These strategies will ensure all New Yorkers are ready for today's job market through attainable diplomas and credentials paired with digital literacy and professional skills training, résumé development, job search and networking support, and other services that reduce barriers to employment. To further expand access, DOL and SUNY will work to braid federal funding and partnerships with other State agencies and community resources to ensure more New Yorkers can access these training opportunities and receive comprehensive wrap-around services throughout the process.

These changes will be coordinated with the latest addition to New York's job training arsenal: the Office of

Strategic Workforce Development. Last year, Governor Hochul's creation of this office marked a decisive shift in the State's workforce development strategy to one that is employer-driven, aligning skills training with real- time employer needs, and focused on strategic growth industries - sectors like tech, advanced manufacturing, and electronics, which are poised to drive economic growth in the coming decade and more. Equipped with a data and outcomes-driven mission and a $150 million grant program to support new innovative programming and scale what is already working, the Office will continue to award grants to proven providers that ensure New Yorkers are ready to meet employer needs, while expanding access for marginalized communities through wraparound services and other tested models that reduce systemwide inequities.

In the coming year, Governor Hochul will articulate a new, statewide framework that will guide New York's workforce development strategy. It will ensure that all agencies undertaking and funding workforce development projects are advancing in the same direction through better coordination, standardized system-level targets, and uniform metrics for success.",165,169,high
2023,2023SOTSBook.pdf,Economic development / business,Part IV-C: Prepare For Future Emergencies,Match Federal Technology Innovation Funding,Empire State Development,,funding/tax/benefit,no,,executive_budget,First-pass coding from 2023 SOTS table of contents.,2023-078,Empire State Development,,funding/tax/benefit,executive_budget,no,,technology_innovation_economic_development,"budget appropriation, program awards, or fiscal documents",cleaned_toc_pass,new,,,,"Also known as ""America's Seed Fund,"" the Small Business Innovation Research (SBIR) and Small Business Technology Transfer (STTR) programs are competitive federal programs that incentivize small businesses to engage in research and development with the potential for commercialization. They are two of the nation's largest sources of early-stage funding for startups and small businesses, with over $3. billion in awards in 2021. Currently, more than half of states have a matching grant program for their SBIR and STTR applicants. New York does not, placing our state at a disadvantage when it comes to attracting and generating innovation investments.

To remedy this, Governor Hochul will create a Technology Innovation Matching Program, which will provide millions of dollars in matching grants for New York companies applying for SBIR and STTR funding. This additional matching investment from New York will support the growth of small businesses and the development of new scientific advancements, while simultaneously creating jobs and keeping New York competitive with other states for these investments.",170,170,high
