year,source_document,section_bucket,subsection,proposal_title,lead_agency,supporting_agencies,commitment_type,quantified,metric_or_target,implementation_pathway,notes,commitment_id,lead_agency_standardized,supporting_agencies_standardized,item_type_clean,implementation_pathway_clean,binary_evaluable,binary_unit,overlap_theme,status_evidence_needed,source_quality,continuity_to_prior_year,matched_prior_commitment_id,matched_prior_title,match_basis,commitment_text,source_page,source_page_end,text_capture_confidence
2023,2023SOTSBook.pdf,Public safety / justice,,Counter Cyber Threats,DCJS,Division of Homeland Security and Emergency Services,other,no,,mixed,First-pass coding from 2023 SOTS table of contents.,2023-037,DCJS,Division of Homeland Security and Emergency Services,other,mixed,no,,cyber_emergency_response,agency report or official implementation evidence,cleaned_toc_pass,new,,,,"The frequency, magnitude, and impact of cyber threats continue to increase. Ransomware attacks, in which hackers hold data and systems hostage, rose 13 percent in 2021, and since 2017, more than 3,600 state, local, and tribal governments across the country have been hit. In 2022, the State's Division of Homeland Security and Emergency Services (DHSES) responded to 57 cyber incidents across New York in support of counties, local governments, state entities, and others. A recent attack in Suffolk County severely impacted government operations and resident services for months. Small and medium-sized enterprises and vulnerable populations (communities of color, immigrants, seniors) are especially targeted in financially motivated cyberattacks.

To better protect residents from cyberattacks and their effects, Governor Hochul is directing DHSES' Office of Counterterrorism to create New York's first ever specialized Industrial Control Systems (ICS) assessment team. The team will work alongside the agency's physical security and cybersecurity assessment programs to help critical infrastructure facilities across

the state improve their overall cybersecurity posture and make their ICS and operational technology systems more resilient to cyberattacks.

SECTION IV: BUILDING A HEALTH CARE SYSTEM FOR NEW YORK'S FUTURE

The health and well-being of every New Yorker depends on a strong, stable, and equitable health care system. Through wise investments, careful planning, and the devoted efforts of the health care workforce, the state has one of the strongest health care systems in the U.S. For example, just five percent of New Yorkers are uninsured, compared to eight percent nationwide. 36

Around 29 percent of people in the state are obese, below the 34 percent national rate. Only 12 percent of New Yorkers smoke, below the 14. percent nationwide. 37

There is still much to do. The pandemic taxed an already strained health care system, exacerbating disparities and systemic health care delivery issues, as well as causing entirely new problems. The workforce is the lifeblood of the health care system, and the industry was growing steadily until COVID-19. By the end of

2020, however, the health care workforce had declined by nearly four percent, and now remains at three percent below pre-pandemic levels. The decline in

nursing home and residential care workers was particularly pronounced - levels are 12 percent lower than the pre-pandemic workforce. 39

Similarly, the number of staffed hospital beds has declined, which is impacting access to care, especially in places such as Olean, Rochester, and Syracuse. Additionally, our hospitals still rely heavily on temporary nursing labor, especially upstate. At 3. hours, New York now has one of the longest average wait times for patients to see emergency doctors in the country - only five states have a longer average wait time. In the Capital Region, the average wait is more

than 4. hours.

To address these challenges, Governor Hochul last year made an historic $20 billion, multi-year investment in health care. Key components of the multi-year investment included:

• $1. billion of State support for health care and mental hygiene worker retention bonuses, with up to $3,000 bonuses going to full-time workers

who remain in their positions for one year, and prorated bonuses for those working fewer hours.

• $7. billion to be spent over four years to increase the home care worker minimum wage by $3 per hour.

• $500 million for Cost-of-Living Adjustments (COLAs) to help raise wages for human services workers.

• $2. billion for health care capital infrastructure and improved lab capacity, along with other investments in workforce and health care access and delivery.

• $3. billion in funding to provide aid to hospitals struggling financially from the COVID-19 pandemic.

The State continues to invest in the system, providing increasing subsidies to hospitals and nursing homes. However, the growth in these subsidies is unsustainable. Since 2020, the proportion of hospitals that require State financial support is up 214 percent, and the total amount of State subsidy provided to hospitals is up 286 percent. And while the actions

Governor Hochul took last year have helped shore up the health care workforce, it is still smaller than pre- pandemic levels. 41,42

Despite the State increasing investments and new initiatives, New York falls well below national performance on measures of quality, ranking 47th of 50 on hospital quality. New York lags behind the nation on

key social determinants of health and health outcomes, such as income inequality (worst in the nation) , high-

risk HIV behaviors (41st of 50 states) , and high blood

pressure (31st). These determinants have a

disproportionate impact on vulnerable populations. For example, Black New Yorkers have higher rates of infant mortality, maternal mortality, and opioid overdoses. 47 48 49

To address the challenges facing our health system over the next four years and improve quality, outcomes, and equity - and to build on the historic health care investments made in 2022 - Governor Hochul will:

• Transform how we pay for and deliver care: Build a comprehensive and evidence-based strategy for the health care system, and deploy capital to support transformation

• Strengthen the foundation: Address the most pressing health needs facing New Yorkers right now, with a particular focus on New Yorkers from underserved communities

• Prepare for future emergencies: Establish a nation-leading public health disease response and surveillance system

Our goal is to ensure that every New Yorker gets the care they need, when they need it, and how they need it.

Part IV-A: Transform how we pay for and deliver care",89,95,high
2023,2023SOTSBook.pdf,Health care,Part IV-A: Transform how we pay for and deliver care,Establish a Commission on the Future of Health Care,DOH,,program/governance,no,,mixed,First-pass coding from 2023 SOTS table of contents.,2023-038,DOH,,program/governance,executive_action,yes,established,health_system_planning,"executive order, agency launch, or official announcement",cleaned_toc_pass,new,,,,"The health care system has changed dramatically since the beginning of the pandemic. The workforce crisis continues, utilization of health care services - especially inpatient hospital services - is down, and

the delivery of care is shifting, with increased adoption of digital, outpatient, and in-the-home services. Health care providers are struggling to keep up with this shift, and rural and urban providers are experiencing these trends differently. Total operating subsidies for

hospitals have increased threefold since pre-pandemic levels, from $745 million (FY20) to $2. billion (FY23), but challenges related to access, quality, outcomes, and equity continue.

Governor Hochul believes that the State needs a holistic strategy to address the numerous challenges and opportunities ahead and needs better insight to develop effective policies and make targeted investments in health care. That is why she will establish a new 'Future of Health Care' Commission to provide ongoing strategic guidance for the transformation of the health care system in New York State. To improve access and quality of care, health outcomes, root out waste in the system, and create long-term stability, including a plan for struggling hospitals, this new body will:

• Drive a holistic and data-driven view of the State's health care delivery system.

• Develop and evolve a comprehensive, evidence- based strategy and roadmap for the transformation of the system.

• Guide statewide and regional planning with both short and long-term objectives across the continuum of care.

• Make recommendations on policy, regulation, reimbursement and other strategies to improve outcomes and transform care delivery.

• Shape the allocation strategy of subsidies for financially distressed hospitals and nursing homes and health care capital funding.

• Drive strategic and operational assessments and transformation initiatives of health care institutions.",95,97,high
2023,2023SOTSBook.pdf,Health care,Part IV-A: Transform how we pay for and deliver care,Provide Transformative Health Care Capital Funding,DOH,,funding/tax/benefit,no,,executive_budget,First-pass coding from 2023 SOTS table of contents.,2023-039,DOH,,funding/tax/benefit,executive_budget,no,,health_care_capital,"budget appropriation, program awards, or fiscal documents",cleaned_toc_pass,new,,,,"Demand for capital funding continues to outpace supply. To drive transformative projects that support the State's health care objectives and align with the recommendations of the Commission, Governor Hochul will allocate additional health care capital on top of the $1. billion committed last year.",97,97,high
2023,2023SOTSBook.pdf,Health care,Part IV-A: Transform how we pay for and deliver care,Establish A New Health Care Technology Capital Program,DOH,,program/governance,no,,mixed,First-pass coding from 2023 SOTS table of contents.,2023-040,DOH,,program/governance,executive_budget,yes,established,health_system_planning,budget appropriation or program line,cleaned_toc_pass,new,,,,"Health care technology is critical to enabling providers to provide high-quality and effective care. More than 45 percent of providers nationally have increased their investments in health care IT in the past year, while 80 percent report it as a top strategic priority. Larger,

urban health care organizations were able to make investments in technology during the pandemic and use more innovative and advanced tools, but smaller, rural organizations had to cut down their investments in technology. Not all providers have up-to-date certified Electronic Health Records (EHRs). For instance, 86 percent of general hospitals have EHRs, but the rates are far lower in specialty (23 percent) or rehabilitation hospitals (40 percent). Additionally, cybersecurity

attacks on providers more than doubled between 2016 and 2021, necessitating technology investments to protect patients. Safety-net providers - who serve the

most vulnerable New Yorkers - have the most significant outstanding technology needs.

That is why Governor Hochul will establish a new capital grant fund to support providers' technological investment upgrades that facilitate the State's health care transformation goals. These funds will spur investment in advanced clinical technologies, cybersecurity tools, and other technological upgrades to improve quality of care, patient experience, accessibility, and efficiency.",98,99,high
2023,2023SOTSBook.pdf,Health care,Part IV-A: Transform how we pay for and deliver care,Reform Traveling Nurse Agency Staffing Practices,DOH,,legislation/regulation,no,,legislation_required,First-pass coding from 2023 SOTS table of contents.,2023-041,DOH,,legislation/regulation,legislation_required,no,,health_care_workforce_regulation,agency report or official implementation evidence,cleaned_toc_pass,new,,,,"During COVID-19, health care providers relied on contracts with temporary staffing agencies for contract staff and traveling nurses to meet the overwhelming demand. Post-pandemic reliance on agency staff at health care facilities has skyrocketed. At some upstate hospitals, usage is five times greater now than it was pre-pandemic. Contract labor can be significantly more expensive than directly employed staff, and as a result, labor costs have increased significantly for providers. 54

Governor Hochul will introduce legislation to require staffing agencies to register and report key data about their operations with the goal of increasing transparency into the utilization and costs of contract

labor. The State will use the collected data to explore options to remedy the dependence upon, and escalating costs related to, agency staffing.",99,100,high
2023,2023SOTSBook.pdf,Health care,Part IV-A: Transform how we pay for and deliver care,Allow Health Care Providers to Do More,DOH,,other,no,,mixed,First-pass coding from 2023 SOTS table of contents.,2023-042,DOH,,other,mixed,yes,authorized,health_care_workforce_regulation,"executive order, agency launch, or official announcement",cleaned_toc_pass,new,,,,"The health care workforce shortage in New York has led to access and quality of care problems for New Yorkers. Governor Hochul signed an Executive Order in September 2021 to acknowledge this shortage and provide flexibility to allow health care providers to temporarily do more (expanding their ""scope of practice"") under their licenses. Making these flexibilities permanent and expanding scope further will help alleviate the shortage, by continuing to allow the current workforce system to provide more care. In addition, Governor Hochul will advance legislation to allow New York to join the Interstate Licensure Compact and the Nurse Licensure Compact, which will make it easier for physicians and nurses licensed in other states to practice in New York, either physically or virtually, and allow New York providers to provide virtual care more easily for their patients who travel to other states.",100,100,high
2023,2023SOTSBook.pdf,Health care,Part IV-A: Transform how we pay for and deliver care,Reform Approval Processes of Health Care Projects,DOH,,legislation/regulation,no,,legislation_required,First-pass coding from 2023 SOTS table of contents.,2023-043,DOH,,legislation/regulation,legislation_required,no,,health_care_workforce_regulation,agency report or official implementation evidence,cleaned_toc_pass,new,,,,"Health care providers face administrative barriers when seeking to modernize and invest in their facilities, including the Certificate of Need (CON) process, which governs the establishment, construction, and renovation of health care facilities. Governor Hochul will direct the Department of Health to review and amend the CON process, including raising the cost threshold for projects that need to file a CON and revisiting the definition of ""public need"" used in the application process. These and other CON reforms will reduce red tape and approval times for more rapid modernization of the state's health care infrastructure. The administration will also take steps to ensure that significant private sector health care transactions support the financial sustainability, access, and quality of care objectives for the health care system.

Part IV-B: Strengthen The Foundation",101,102,high
2023,2023SOTSBook.pdf,Health care,Part IV-B: Strengthen The Foundation,Expand Medicaid Coverage of Preventative Health Services,DOH,,program/policy,no,,mixed,First-pass coding from 2023 SOTS table of contents.,2023-044,DOH,,program/policy,mixed,no,,medicaid_coverage,"implementation metrics, agency reports, or budget plus rollout evidence",cleaned_toc_pass,expansion,2022-020,Expand Medicaid Coverage for Postpartum Care,"theme=medicaid_coverage; shared_terms=coverage, medicaid","Medicaid provides comprehensive health insurance to 7. million low-income New Yorkers. Medicaid enrollees are less likely to use regular medical or dental services and more likely to visit an emergency room 55 56

versus those on private insurance. Medicaid enrollees are more likely to smoke (23 percent versus 10 percent of New Yorkers with private insurance), have high

blood pressure (30 percent versus 25 percent), have 58

diabetes (12 percent versus eight percent) or have59

other chronic conditions. Medicaid enrollees also have

worse health outcomes - for example, 61 percent of maternal deaths are Medicaid enrollees, but only 50 percent of the state's births are covered by Medicaid. 61

To address these issues, Governor Hochul will support critical preventative care for Medicaid enrollees that will help improve population health and reduce hospitalizations, including: increasing supportive housing funding, expanding Adverse Childhood Experiences screening, expanding coverage for nutritionist services, expanding coverage for therapy,

increasing dental care rates, increasing rates for children's vaccine administration, expanding coverage of spinal muscular atrophy prenatal screening, expanding screening for social determinants of health, and expanding coverage for Doula services.",102,103,high
2023,2023SOTSBook.pdf,Health care,Part IV-B: Strengthen The Foundation,Expand the Medicaid Buy-In Program for New Yorkers with Disabilities,DOH,,program/policy,no,,mixed,First-pass coding from 2023 SOTS table of contents.,2023-045,DOH,,program/policy,mixed,no,,medicaid_coverage,"implementation metrics, agency reports, or budget plus rollout evidence",cleaned_toc_pass,expansion,2022-020,Expand Medicaid Coverage for Postpartum Care,theme=medicaid_coverage; shared_terms=medicaid,"Medicaid coverage is essential for accessing long-term supports and services like home care. Without Medicaid coverage, the median out-of-pocket cost of a home health aide is more than $66,000 per year in New York - unaffordable for many people. Too many persons

with disabilities are faced with the difficult choice between maintaining their coverage and pursuing employment opportunities due to the current Medicaid eligibility income and asset limits. More than one-third of working-age disabled adults fear that getting a job would mean losing their health insurance. Governor Hochul will submit a waiver to expand the Medicaid Buy-In program so more New Yorkers with disabilities can work and still qualify for Medicaid coverage.",103,103,high
2023,2023SOTSBook.pdf,Health care,Part IV-B: Strengthen The Foundation,Improve Essential Plan Coverage,DOH,,program/policy,no,,mixed,First-pass coding from 2023 SOTS table of contents.,2023-046,DOH,,program/policy,mixed,no,,medicaid_coverage,"implementation metrics, agency reports, or budget plus rollout evidence",cleaned_toc_pass,follow_on,2022-020,Expand Medicaid Coverage for Postpartum Care,theme=medicaid_coverage; shared_terms=coverage,"The Essential Plan offers comprehensive health coverage to more than 1 million New York residents with incomes below 200 percent of the federal poverty level ($27,000 for a single individual). To make health care coverage more affordable, accessible, and equitable, Governor Hochul will explore several changes to improve the Essential Plan. These will include reducing cost sharing for patients, ensuring access by increasing reimbursement rates for health care providers, expanding funding for health plans to broaden coverage of mental health and social services, and requiring health plans to spend more on patient care.",104,104,high
2023,2023SOTSBook.pdf,Health care,Part IV-B: Strengthen The Foundation,Protect New Yorkers from Medical Debt and Other Burdensome Medical Costs,DOH,,other,no,,mixed,First-pass coding from 2023 SOTS table of contents.,2023-047,DOH,,other,mixed,no,,health_care_general,agency report or official implementation evidence,cleaned_toc_pass,continuation,2022-002,Increase the Training Capacity of Medical Institutions,theme=health_care_general; shared_terms=medical,"One in five people has outstanding medical bills in collections, totaling $88 billion nationwide. Medical

debt can be unpredictable and have serious financial implications, with 53,000 New Yorkers sued by hospitals from 2015 to 2020. It can also have a

significant impact on an individual's ability to find housing, secure employment, access higher education, or participate in the financial marketplace. Governor Hochul has already taken steps to address this problem - for example, announcing regulations last year to protect consumers facing surprise medical bills as well as prohibiting hospitals from placing liens on patients' homes or garnishing their wages to collect on medical debt. This year, Governor Hochul will go one step further and create a comprehensive plan to address excessive medical debt, including (1) amending the Consumer Credit Fairness Act to cover medical debt; (2) launching an industry and consumer education campaign that addresses medical debt and affordability; and (3) reforming hospital financial assistance applications to require hospitals to use a uniform application form.

Governor Hochul will take additional steps to protect New Yorkers from burdensome medical costs. New York will establish the strongest prescription drug price transparency program in the country by building on the Pharmacy Benefit Bureau launched last year, requiring drug manufacturers to report, in advance, changes in

drug prices and make that information publicly available to consumers. In addition, we will explore the creation of a new Health Guaranty Fund to protect New Yorkers if a health insurer becomes financially impaired or insolvent, similar to what is in place for life and property insurers.",104,106,high
2023,2023SOTSBook.pdf,Health care,Part IV-B: Strengthen The Foundation,Expand Access to Primary Care,DOH,,program/policy,no,,mixed,First-pass coding from 2023 SOTS table of contents.,2023-048,DOH,,program/policy,mixed,no,,primary_care_and_ems,"implementation metrics, agency reports, or budget plus rollout evidence",cleaned_toc_pass,expansion,2022-021,Improve and Expand Access to Prenatal and Postnatal Care,"theme=primary_care_and_ems; shared_terms=access, care","New Yorkers in underserved communities are much less likely to access primary care, and New York's rural areas have almost 80 percent fewer primary care providers per capita than urban areas. This lack of

primary care leads to poor health outcomes and higher costs. In fact, almost 50 percent of all emergency department visits in New York State could have been treated with primary care, and even more could have been avoided. These costs hit the state particularly 66.

hard: Medicaid enrollees are significantly more likely to visit the emergency department than those with commercial insurance. 67

Governor Hochul will support evidence-based interventions to improve access to primary care for

Medicaid enrollees and reduce preventable hospitalizations and emergency room visits by:

• Increasing overall Medicaid reimbursement rates for all primary care, and specifically for nurse practitioners, who are critical providers of primary care.

• Ensuring Medicaid coverage of primary and urgent care within the shelter system, which is expected to help tens of thousands of New Yorkers facing housing insecurity to access care.

• Expanding Medicaid coverage of community health workers to help hundreds of thousands of New Yorkers navigate health and social services.

• Increasing Medicaid reimbursement rates for school-based health centers, which increase access to primary care and other health services for children and their families.

• Supporting the integration of primary and mental health care through several initiatives, including allowing Medicaid reimbursement for additional types of licensed mental health providers in community health centers,

establishing a working group on integrated care, and relaxing licensure restrictions for Article 28, 31, and 32 facilities - such as hospitals, outpatient clinics, and behavioral health clinics.",106,108,high
2023,2023SOTSBook.pdf,Health care,Part IV-B: Strengthen The Foundation,Revitalize Emergency Medical Services and Medical Transportation,DOH,,other,no,,mixed,First-pass coding from 2023 SOTS table of contents.,2023-049,DOH,,other,mixed,no,,primary_care_and_ems,agency report or official implementation evidence,cleaned_toc_pass,new,,,,"The availability of emergency transportation and emergency medical technicians varies significantly, as rural residents wait nearly twice as long for an emergency responder as suburban and urban residents nationwide. Compounding this issue, the number of

emergency medical services (EMS) agencies in the state declined from 1,200 pre-pandemic to less than 1,000 post-pandemic, while the number of new EMTs declined by 30 percent over the same time period. These agencies in New York lack comprehensive coordination, which makes it difficult for the state to collectively respond appropriately in emergencies or disasters. Governor Hochul will take several steps to help solve these issues:

• Ensure emergency transportation providers are appropriately reimbursed for trips, increasing payment for more complex patients.

• Establish a working group to recommend ways to expand access to non-emergency medical transportation.

• Establish nine regional EMS organizations that can better coordinate all the EMS agencies and providers operating within their region and a statewide EMS disaster response system that can rapidly deploy personnel and equipment when and where it is needed during an emergency.

• Allow EMS providers to perform expanded clinical care in the community.

• Permit ambulances to treat patients in place or take patients to urgent care clinics without sacrificing payment for the trip, decreasing the number of unnecessary emergency room visits.",108,109,high
