commitment_id,proposal_title,overlap_theme,continuity_to_prior_year,matched_prior_commitment_id,matched_prior_title,match_basis
2026182,Investing in Older Adults,health_care_general,new,,,
2026183,Assisting Older Adults to Age in Place,health_care_general,new,,,
2026184,Improving Access to End-of-Life Care,health_care_general,continuation,2025163,Expand Access to Dental Care,"theme=health_care_general; shared_terms=access, care"
2026185,"Protecting Older Adults from Abuse, Scams, and Fraud",health_care_general,new,,,
2026186,Creating a One-Stop Shop for Benefits for Older New Yorkers,aging_long_term_care,new,,,
2026187,Protecting Immunization Access,health_care_general,continuation,2025160,Expand Access to Infertility Treatments,theme=health_care_general; shared_terms=access
2026188,Improving Vital Records Access,health_care_general,continuation,2025158,Improving the Health of All New Yorkers,theme=health_care_general; shared_terms=improving
2026189,Strengthening Cardiac Emergency Readiness across New York State,health_care_general,new,,,
2026190,Modernizing Pain Management Guidance and Care,health_care_general,continuation,2025163,Expand Access to Dental Care,theme=health_care_general; shared_terms=care
2026191,Protecting Summer Campers from Extreme Weather Threats,health_care_general,new,,,
2026192,Establishing a Nuclear Reliability Backbone for a Zero-Emission Grid,energy_affordability,new,,,
2026193,Ensuring New York's Nuclear Power Future is Built By and For New Yorkers,energy_affordability,new,,,
