commitment_id,proposal_title,overlap_theme,continuity_to_prior_year,matched_prior_commitment_id,matched_prior_title,match_basis
2026-001,Launching 2-Care for New York City Families,disability_inclusion,new,,,
2026-002,Reaching Universal 3K Access within New York City,child_care_access,continuation,2025-002,Vastly Expand New York's Child Tax Credit,theme=child_care_access; shared_terms=
2026-003,Continuing to Expand the Child Care Assistance Program for Families Statewide,child_care_access,expansion,2025-012,Create the New York Coalition for Child Care,"theme=child_care_access; shared_terms=care, child"
2026-004,Piloting Innovative Community Care Models,child_care_access,continuation,2025-012,Create the New York Coalition for Child Care,theme=child_care_access; shared_terms=care
2026-005,Helping Defray Child Care Costs by Overhauling the Child and Dependent Care Tax Credit,child_care_access,continuation,2025-002,Vastly Expand New York's Child Tax Credit,"theme=child_care_access; shared_terms=child, credit, tax"
2026-006,Launching the Office of Child Care and Early Education to Drive Universal Child Care,child_care_access,continuation,2025-012,Create the New York Coalition for Child Care,"theme=child_care_access; shared_terms=care, child"
2026-007,Supporting Our Farmers' Families and Children,child_care_access,continuation,2025-002,Vastly Expand New York's Child Tax Credit,theme=child_care_access; shared_terms=
2026-008,Making It Easier to Provide Child Care,child_care_access,continuation,2025-012,Create the New York Coalition for Child Care,"theme=child_care_access; shared_terms=care, child"
2026-009,Engaging with Employers as Partners,child_care_access,continuation,2025-002,Vastly Expand New York's Child Tax Credit,theme=child_care_access; shared_terms=
2026-010,Supporting the Workforce through Early Childhood Educator Preparation,college_workforce_pathways,new,,,
2026-011,Boosting Awareness of the Child Tax Credit (CTC),child_care_access,continuation,2025-002,Vastly Expand New York's Child Tax Credit,"theme=child_care_access; shared_terms=child, credit, tax"
2026-012,Lowering Rates by Cracking Down on Fraud,state_police_capacity,continuation,2025-034,Strengthen the State's Response Against Transnational Criminal Networks,theme=state_police_capacity; shared_terms=
2026-013,Strengthening Insurer Anti-Fraud Programs,unclear,continuation,2025-138,Increase Funding for Rape Crisis Programs,theme=unclear; shared_terms=programs
2026-014,Limiting Damages for Individuals Engaging in Unlawful Behavior at the Time of an Accident,unclear,continuation,2025-020,Streamline the Part-Time Tuition Assistance Program,theme=unclear; shared_terms=time
2026-015,Limiting Damages for Individuals Who Are “Mostly” at Fault in Causing an Accident,unclear,continuation,2025-039,Ensure Child Victims of Crime Are Maximally Supported,theme=unclear; shared_terms=are
2026-016,Tightening the Serious Injury Threshold,unclear,continuation,2025-073,Facilitate Advanced Injury Detection for Thoroughbred Racing,theme=unclear; shared_terms=injury
2026-017,"Ensuring Consumers, Not Insurance Companies, Benefit from Savings",unclear,continuation,2025-134,Hold Energy Service Companies Accountable for Revenue Return,theme=unclear; shared_terms=companies
2026-018,Increasing Transparency for Policyholders in the Auto Insurance Market,unclear,continuation,2025-122,Help Affordable Housing Access Captive Insurance to Lower Costs,theme=unclear; shared_terms=insurance
2026-019,Improving Incentives to Drive Safely,unclear,continuation,2025-053,Reclassify Ultra-Heavy Class 3 E-Bikes as Mopeds,theme=unclear; shared_terms=
2026-020,Tracking Home Insurer Profitability,unclear,continuation,2025-108,Strengthen Laws and Policies to Combat Home Appraisal Discrimination,theme=unclear; shared_terms=home
2026-021,Increasing Property Insurance Transparency,unclear,continuation,2025-122,Help Affordable Housing Access Captive Insurance to Lower Costs,theme=unclear; shared_terms=insurance
2026-022,Expanding Automatic Discounts for Homeowners,unclear,continuation,2025-028,Get More Kids Swimming and Prevent Child Drowning,theme=unclear; shared_terms=
2026-023,Expanding Automatic Discounts for Commercial Multifamily Properties,unclear,continuation,2025-115,Empower Communities to Redevelop Vacant Properties into Housing,theme=unclear; shared_terms=properties
2026-024,Increasing Transparency for Policyholders in the Home Insurance Market,unclear,continuation,2025-108,Strengthen Laws and Policies to Combat Home Appraisal Discrimination,theme=unclear; shared_terms=home
2026-025,Convening Stakeholders to Bring Down Home and Property Insurance Costs,unclear,continuation,2025-122,Help Affordable Housing Access Captive Insurance to Lower Costs,"theme=unclear; shared_terms=costs, insurance"
2026-026,Protecting Renters and Rent-Stabilized Housing,unclear,continuation,2025-113,Double New York State Low Income Housing Credits,theme=unclear; shared_terms=housing
2026-027,Enhancing Penalties to Protect Rent-Regulated Tenants from Pervasive Harassment,unclear,continuation,2025-121,Extend Security Deposit Protections to Rent-Regulated Tenants,"theme=unclear; shared_terms=regulated, rent, tenants"
2026-028,Reforming J-51 to Preserve More Rent-Regulated Housing,unclear,continuation,2025-121,Extend Security Deposit Protections to Rent-Regulated Tenants,"theme=unclear; shared_terms=regulated, rent"
2026-029,Expanding a Critical Rent Freeze Program for Seniors and People with Disabilities,disability_inclusion,new,,,
2026-030,Tackling Utility Costs,unclear,continuation,2025-122,Help Affordable Housing Access Captive Insurance to Lower Costs,theme=unclear; shared_terms=costs
2026-031,Improving Fairness for Ratepayers Through Affordable Utilities Omnibus Legislation,unclear,continuation,2025-056,Promote Opportunity with Electric Readiness for Underdeveloped Properties Fund,theme=unclear; shared_terms=
2026-032,Revitalizing EmPower+ to Upgrade Homes,unclear,continuation,2025-056,Promote Opportunity with Electric Readiness for Underdeveloped Properties Fund,theme=unclear; shared_terms=
2026-033,Excelsior Power: Cheaper Utility Bills for a More Flexible and Affordable Grid,unclear,continuation,2025-056,Promote Opportunity with Electric Readiness for Underdeveloped Properties Fund,theme=unclear; shared_terms=
2026-034,Increasing Uptake of Energy Assistance Programs,unclear,continuation,2025-057,Build Clean Energy Zones,theme=unclear; shared_terms=energy
2026-035,Requiring Data Centers to Pay Their Fair Share and Streamlining Interconnections for Job-Creating Businesses,unclear,continuation,2025-056,Promote Opportunity with Electric Readiness for Underdeveloped Properties Fund,theme=unclear; shared_terms=
2026-036,Protecting Tenants from Unfair Utility Shutoffs,unclear,continuation,2025-028,Get More Kids Swimming and Prevent Child Drowning,theme=unclear; shared_terms=
2026-037,Mitigating Energy Cost Burden,unclear,continuation,2025-057,Build Clean Energy Zones,theme=unclear; shared_terms=energy
2026-038,Modernizing Utility Regulation to Protect Consumers,unclear,new,,,
2026-039,Helping Put Food on the Table,unclear,new,,,
2026-040,Investing in Food Banks and Pantries,unclear,new,,,
2026-041,Investing in New York PLATES,unclear,new,,,
2026-042,Slashing Food Benefits Theft with Modern EBT Cards,unclear,continuation,2025-082,Expand Enforcement Power Following an Unpaid Wage Theft Judgment,theme=unclear; shared_terms=theft
2026-043,Promoting SNAP to Students and Families,unclear,continuation,2025-015,Provide Universal School Meals,theme=unclear; shared_terms=
2026-044,Expanding Free Summer Meal Sites,unclear,continuation,2025-017,Boost Literacy with Free Books from Dolly Parton's Imagination Library,theme=unclear; shared_terms=free
2026-045,Supporting Rural Summer Meals,food_access_agriculture,continuation,2025-067,Supporting Agriculture,theme=food_access_agriculture; shared_terms=supporting
2026-046,Promoting Summer EBT Across Agencies,digital_government,new,,,
2026-047,Stopping Illegal Homegrown Guns,unclear,new,,,
2026-048,Cracking Down on 3D-Printed Firearms,gun_violence,new,,,
2026-049,Taking Aim at DIY Machine Guns,unclear,new,,,
2026-050,Protecting Our Neighbors' Rights,unclear,continuation,2025-049,"Protecting Pedestrians, Workers, Drivers, and Cyclists",theme=unclear; shared_terms=protecting
2026-051,Establishing a Right to Sue Federal Officers for Constitutional Violations,unclear,continuation,2025-003,Fight for Federal Tax Relief,theme=unclear; shared_terms=federal
2026-052,Protecting New Yorkers in Sensitive Locations,child_care_access,continuation,2025-002,Vastly Expand New York's Child Tax Credit,theme=child_care_access; shared_terms=
2026-053,Protecting Safe Access to Worship and Healthcare,unclear,continuation,2025-037,Support Safe and Vibrant Communities,theme=unclear; shared_terms=safe
2026-054,Safeguarding Our Roads,unclear,continuation,2025-126,Invest in New York Roads and Statewide Transit,theme=unclear; shared_terms=roads
2026-055,Launching the Next Phase of the Autonomous Vehicle Pilot Program,state_police_capacity,continuation,2025-034,Strengthen the State's Response Against Transnational Criminal Networks,theme=state_police_capacity; shared_terms=
2026-056,Stopping New York City's Super Speeders through Intelligent Speed Assistance,street_safety,new,,,
2026-057,Ensuring Safety First in Work Zones,unclear,continuation,2025-053,Reclassify Ultra-Heavy Class 3 E-Bikes as Mopeds,theme=unclear; shared_terms=
2026-058,Strengthening Motorcycle Licensing Standards for New and Inexperienced Riders,unclear,continuation,2025-053,Reclassify Ultra-Heavy Class 3 E-Bikes as Mopeds,theme=unclear; shared_terms=
2026-059,Prioritizing Safety on the Subway,unclear,continuation,2025-052,Improve Safety at New York City's Elementary School Intersections,theme=unclear; shared_terms=safety
2026-060,Sustaining Record Lows in Subway Crime by Putting Police on Platforms,unclear,continuation,2025-039,Ensure Child Victims of Crime Are Maximally Supported,theme=unclear; shared_terms=crime
2026-061,Expanding SCOUT Teams in the Subway System,mental_health_supportive_housing,continuation,2025-147,Expand Intensive and Sustained Engagement Teams,theme=mental_health_supportive_housing; shared_terms=teams
2026-062,Protecting Riders with Platform Edge Barriers,unclear,continuation,2025-053,Reclassify Ultra-Heavy Class 3 E-Bikes as Mopeds,theme=unclear; shared_terms=
2026-063,Combating Crime and Ensuring Justice,unclear,continuation,2025-037,Support Safe and Vibrant Communities,theme=unclear; shared_terms=
2026-064,Expanding Crime Analysis Centers Statewide,unclear,continuation,2025-139,Expand Statewide Targeted Reductions in Intimate Partner Violence,theme=unclear; shared_terms=statewide
2026-065,Solving Crimes by Investing in Crime Labs,unclear,continuation,2025-037,Support Safe and Vibrant Communities,theme=unclear; shared_terms=
2026-066,Improving Police Training Academies,unclear,continuation,2025-076,Facilitate New Training Pathways into High-Demand Occupations,theme=unclear; shared_terms=training
2026-067,Supporting State Police after Critical Incidents,state_police_capacity,new,,,
2026-068,Extending Orders of Protection,unclear,new,,,
2026-069,Supporting At-Risk and Survivor-Led Victim Assistance Programs,unclear,continuation,2025-041,Supporting our First Responders,theme=unclear; shared_terms=supporting
2026-070,Streamlining and Promoting Access to Victim Compensation,unclear,continuation,2025-038,Expand Victim Support Services to Protect Vulnerable Populations,theme=unclear; shared_terms=victim
2026-071,Reforming Sexual Offense Evidence Collection Kit Procedures,unclear,continuation,2025-030,Outlaw Artificial Intelligence-Generated Child Sexual Abuse Material,theme=unclear; shared_terms=sexual
2026-072,Streamlining Justice by Reducing Costs and Delays in Grand Jury Proceedings,state_police_capacity,new,,,
2026-073,Improving Emergency and Disaster Response,unclear,new,,,
2026-074,Enhancing Readiness for Mass Violence Events,unclear,continuation,2025-025,Invest in Playgrounds,theme=unclear; shared_terms=
2026-075,Strengthening Statewide Urban Search and Rescue Capacity,cyber_emergency_response,continuation,2025-100,Bolster the Security of Networks Statewide,theme=cyber_emergency_response; shared_terms=statewide
2026-076,Partnering with Canada to Strengthen Disaster Response,cyber_emergency_response,new,,,
2026-077,Developing a Comprehensive Plan for Drones,state_police_capacity,continuation,2025-034,Strengthen the State's Response Against Transnational Criminal Networks,theme=state_police_capacity; shared_terms=
2026-078,Supporting First Responders' Behavioral Health Needs,college_workforce_pathways,continuation,2025-042,Launch First Responder Counseling Scholarship Program,theme=college_workforce_pathways; shared_terms=first
2026-079,Building More Housing,unclear,continuation,2025-113,Double New York State Low Income Housing Credits,theme=unclear; shared_terms=housing
2026-080,Investing an Additional $250 Million to Accelerate Affordable Housing,mental_health_supportive_housing,expansion,2025-119,Expand Capital to Maintain and Improve Supportive Housing,theme=mental_health_supportive_housing; shared_terms=housing
2026-081,Embracing Innovative Approaches to Build Homes More Quickly and at Lower Costs,aging_long_term_care,new,,,
2026-082,Expanding the Number of Land Banks Permitted,unclear,continuation,2025-114,Unlock Historic Tax Credits by Decoupling and Expanding Eligibility,theme=unclear; shared_terms=expanding
2026-083,Creating the Manufactured Homes Park Improvement Revolving Loan Fund,unclear,continuation,2025-112,Launch New York State's First Mixed-Income Revolving Loan Fund,"theme=unclear; shared_terms=fund, loan, revolving"
2026-084,Delivering Clean and Safe Water,aging_long_term_care,continuation,2025-104,Provide Starter Home Innovation Funding,theme=aging_long_term_care; shared_terms=
2026-085,Tapping Into Growth: Expanding Water Resources to Unlock New Housing Development,housing_supply,continuation,2025-109,Create a Pro-Housing Supply Infrastructure Fund,theme=housing_supply; shared_terms=housing
2026-086,Addressing Contamination from Landfills to Protect Water Quality,recycling_waste,continuation,2025-095,Embrace a Circular Economy at the Empire State Plaza,theme=recycling_waste; shared_terms=
2026-087,Getting the Lead Out,unclear,continuation,2025-028,Get More Kids Swimming and Prevent Child Drowning,theme=unclear; shared_terms=
2026-088,Upgrading Our Parks,unclear,continuation,2025-028,Get More Kids Swimming and Prevent Child Drowning,theme=unclear; shared_terms=
2026-089,Investing in Rochester's First State Park: High Falls State Park,unclear,continuation,2025-053,Reclassify Ultra-Heavy Class 3 E-Bikes as Mopeds,theme=unclear; shared_terms=
2026-090,Restoring Riverbank's Role as a Community Hub for Harlem and Beyond,aging_long_term_care,new,,,
2026-091,Exploring the Niagara Gorge,unclear,continuation,2025-028,Get More Kids Swimming and Prevent Child Drowning,theme=unclear; shared_terms=
2026-092,Strengthening Our Communities,unclear,continuation,2025-037,Support Safe and Vibrant Communities,theme=unclear; shared_terms=communities
2026-093,Launching NY Kicks: A World Cup Legacy Investment Fund,unclear,continuation,2025-025,Invest in Playgrounds,theme=unclear; shared_terms=
2026-094,Building Community Centers to Foster Connections and Well-Being,unclear,continuation,2025-026,"Launch Get Offline, Get Outside 2.0",theme=unclear; shared_terms=
2026-095,Preserving Performing Art Spaces,unclear,continuation,2025-105,Support First-Time Homebuyers' Down Payment Assistance,theme=unclear; shared_terms=
2026-096,Improving Infrastructure at County Fairs,unclear,new,,,
2026-097,Improving Commutes and Travel,unclear,new,,,
2026-098,Reimagining Jamaica Station for the Millions of Commuters Who Depend on It,digital_government,new,,,
2026-099,Advancing the Second Avenue Subway Crosstown Expansion Project to Improve Commutes,mta_service_and_finance,follow_on,2025-124,Advance Second Avenue Subway and Other Major Transit Improvements,"theme=mta_service_and_finance; shared_terms=avenue, second, subway"
2026-100,Launching the Let Them Build Agenda,housing_supply,continuation,2025-109,Create a Pro-Housing Supply Infrastructure Fund,theme=housing_supply; shared_terms=
2026-101,Helping Our Communities Build Housing We Need,unclear,continuation,2025-115,Empower Communities to Redevelop Vacant Properties into Housing,"theme=unclear; shared_terms=communities, housing"
2026-102,Accelerating Critical Infrastructure Projects,water_quality,new,,,
2026-103,Delivering Faster Decisions for Local Communities through Clear Timelines and Accountability,unclear,continuation,2025-037,Support Safe and Vibrant Communities,theme=unclear; shared_terms=communities
2026-104,Streamlining Environmental Impact Statements to Cut Down Review Timelines,unclear,continuation,2025-111,Streamline Environmental Review for Modest Housing Development,"theme=unclear; shared_terms=environmental, review"
2026-105,Modernizing Permitting Processes to Save Time and Money for Localities,unclear,continuation,2025-028,Get More Kids Swimming and Prevent Child Drowning,theme=unclear; shared_terms=
2026-106,Expediting Major State Infrastructure Projects,unclear,continuation,2025-053,Reclassify Ultra-Heavy Class 3 E-Bikes as Mopeds,theme=unclear; shared_terms=
2026-107,Supporting Local Communities Through a Permitting Academy,unclear,continuation,2025-055,Driving Economic Development,theme=unclear; shared_terms=
2026-108,Driving Economic Growth by Activating Underutilized Sites in the North Country,unclear,continuation,2025-055,Driving Economic Development,"theme=unclear; shared_terms=driving, economic"
2026-109,Making Government Work Better,unclear,continuation,2025-014,Fostering Better Educational Opportunities,theme=unclear; shared_terms=better
2026-110,Making Every New Yorker Count,medicaid_coverage,continuation,2025-009,Expand Lactation Support Services,theme=medicaid_coverage; shared_terms=
2026-111,Tackling Outdated and Burdensome Regulations that Stand in the Way of Delivering,unclear,continuation,2025-105,Support First-Time Homebuyers' Down Payment Assistance,theme=unclear; shared_terms=
2026-112,Streamlining Public Procurement,unclear,continuation,2025-142,Improve Access to Public Assistance for Survivors of Gender-Based Violence,theme=unclear; shared_terms=public
2026-113,Delivering More with Smart Technology,unclear,continuation,2025-031,Make Artificial Intelligence Companion Technology Safer,theme=unclear; shared_terms=technology
2026-114,"Creating a New Office of Digital Innovation, Governance, Integrity, and Trust (DIGIT)",unclear,continuation,2025-025,Invest in Playgrounds,theme=unclear; shared_terms=
2026-115,Protecting Our Private Data,unclear,continuation,2025-053,Reclassify Ultra-Heavy Class 3 E-Bikes as Mopeds,theme=unclear; shared_terms=
2026-116,Requiring Labeling for AI-Generated Content,unclear,continuation,2025-030,Outlaw Artificial Intelligence-Generated Child Sexual Abuse Material,theme=unclear; shared_terms=generated
2026-117,Protecting Elections from Misleading or Deceptive AI Content,unclear,continuation,2025-049,"Protecting Pedestrians, Workers, Drivers, and Cyclists",theme=unclear; shared_terms=protecting
2026-118,Prohibiting Misleading “Discounts” in Online Sales,unclear,new,,,
2026-119,Ending Taxes on Tips,unclear,continuation,2025-118,Reduce Shelter Rent Taxes for Mitchell-Lama Residents,theme=unclear; shared_terms=taxes
2026-120,Fighting Workers' Compensation Fraud,unclear,continuation,2025-085,Expand Access to Medical Care in the Workers' Compensation System,"theme=unclear; shared_terms=compensation, workers"
2026-121,Combating Wage Theft,minimum_wage,new,,,
2026-122,Improving Disclosures for Student Loan Refinancing,unclear,continuation,2025-015,Provide Universal School Meals,theme=unclear; shared_terms=
2026-123,Setting Cosigner Standards for Student Loans,unclear,continuation,2025-015,Provide Universal School Meals,theme=unclear; shared_terms=
2026-124,Enhancing Illegal Vape Enforcement,unclear,continuation,2025-047,Secure Additional Funding for Law Enforcement Technology,theme=unclear; shared_terms=enforcement
2026-125,Promoting Tech and Biotech,economic_development_general,new,,,
2026-126,Making New York State “Chips Country” via a Downstate Semiconductor Chip Design Center,semiconductor_economic_development,continuation,2025-058,Grow the Semiconductor Industry and Build the Semiconductor Supply Chain,theme=semiconductor_economic_development; shared_terms=semiconductor
2026-127,Building Our Quantum Edge through Quantum Technology Commercialization Hubs,college_workforce_pathways,continuation,2025-022,Invest in Cutting-Edge Research by Funding a New York State Innovation Fund,theme=college_workforce_pathways; shared_terms=edge
2026-128,Launching Empire AI Beta and Creating the First Independent AI Research Center at SUNY Binghamton,college_workforce_pathways,continuation,2025-060,Lead on Innovation Through Empire AI,theme=college_workforce_pathways; shared_terms=empire
2026-129,Bolstering Biotechnology Statewide,technology_innovation_economic_development,new,,,
2026-130,Supporting Farmers and Manufacturers,economic_development_general,new,,,
2026-131,Modernizing Manufacturing in Tough Times,economic_development_general,new,,,
2026-132,Supporting Dairy Farmers to Modernize the Industry,aging_long_term_care,new,,,
2026-133,Protecting Farmers from the Disruption of Federal Tariffs,food_access_agriculture,new,,,
2026-134,Developing the Industrial Hemp Pipeline,economic_development_general,new,,,
2026-135,Investing in Equity Across the Cannabis Supply Chain,college_workforce_pathways,new,,,
2026-136,Investing in Communities,economic_development_general,new,,,
2026-137,Establishing New York as the Nation's Hard Cider Capital,economic_development_general,new,,,
2026-138,Modernizing the Alcoholic Beverage Control Law,economic_development_general,new,,,
2026-139,Eliminating Outdated Restrictions on Dancing,economic_development_general,new,,,
2026-140,Enhancing the Downtown Revitalization Initiative and New York Forward,economic_development_general,new,,,
2026-141,Expanding the County Infrastructure Grant Program,economic_development_general,new,,,
2026-142,Enhancing Local Economic Development Project Tracking,economic_development_general,new,,,
2026-143,Back to Basics in Math: Transforming Math Learning through Quality Instruction and Professional Learning,college_workforce_pathways,continuation,2025-019,Launch College in High School Opportunity Fund,theme=college_workforce_pathways; shared_terms=
2026-144,Building on Back to Basics Literacy Through Support for In-Service Teachers,college_workforce_pathways,continuation,2025-019,Launch College in High School Opportunity Fund,theme=college_workforce_pathways; shared_terms=
2026-145,Accelerating Learning with High-Impact Tutoring,tutoring_learning_loss,new,,,
2026-146,Creating a Sustainable Teacher Pipeline,child_care_access,continuation,2025-002,Vastly Expand New York's Child Tax Credit,theme=child_care_access; shared_terms=
2026-147,Establishing the Empire AI Student Challenge,college_workforce_pathways,continuation,2025-021,Invest in Student Success at the State University of New York,theme=college_workforce_pathways; shared_terms=student
2026-148,Increasing Our Understanding of Our School System and Programs to Support our Students,education_general,new,,,
2026-149,Getting Offline and Outside with Cooler Schoolyards,education_general,new,,,
2026-150,"Ensuring Indigenous Youth Have Access to Relevant, Quality Civics Instruction",education_general,new,,,
2026-151,Elevating Excellence: Strengthening Mentoring Programs for Black and Latina Girls,education_general,new,,,
2026-152,Holding the Line on Costs and Promoting College Affordability at SUNY and CUNY,college_workforce_pathways,continuation,2025-075,Fund Free Community College in High-Demand Occupations,theme=college_workforce_pathways; shared_terms=college
2026-153,Enhancing Affordability by Expanding SUNY and CUNY Reconnect for High-Demand Jobs,college_workforce_pathways,continuation,2025-075,Fund Free Community College in High-Demand Occupations,"theme=college_workforce_pathways; shared_terms=demand, high"
2026-154,New York Career Connect Initiative: Better Preparing College Students for the Workforce across New York's Higher Education Systems,college_workforce_pathways,continuation,2025-022,Invest in Cutting-Edge Research by Funding a New York State Innovation Fund,theme=college_workforce_pathways; shared_terms=
2026-155,Enhancing Student Borrower Support,education_general,new,,,
2026-156,Creating Emergency Aid Funds at All SUNY and CUNY Campuses to Keep Students Enrolled,college_workforce_pathways,new,,,
2026-157,Supporting Former Foster Students to Attain a Degree through the Reconnect for Foster Scholars Program,college_workforce_pathways,continuation,2025-042,Launch First Responder Counseling Scholarship Program,theme=college_workforce_pathways; shared_terms=program
2026-158,Promoting Fairness and Affordability for Students by Reforming Tuition Refund Policies at SUNY,college_workforce_pathways,continuation,2025-019,Launch College in High School Opportunity Fund,theme=college_workforce_pathways; shared_terms=
2026-159,Reducing Burden in the Certificate of Residency Process for SUNY Community College and Early College Students,college_workforce_pathways,continuation,2025-019,Launch College in High School Opportunity Fund,theme=college_workforce_pathways; shared_terms=college
