commitment_id,proposal_title,overlap_theme,continuity_to_prior_year,matched_prior_commitment_id,matched_prior_title,match_basis
2026178,"Protecting and Expanding Access to Quality, Affordable Health Coverage",medicaid_coverage,continuation,2025161,Increase Access to Lifesaving Obesity Drugs,theme=medicaid_coverage; shared_terms=access
2026179,Leveraging New York's Purchasing Power to Drive Down Drug Costs,medicaid_coverage,new,,,
2026180,Reforming Prior Authorizations to Improve Patient Care,public_education_funding,new,,,
2026181,Increasing Access to Medical Care for Injured Workers,primary_care_and_ems,continuation,2025162,Ensure Access to Emergency Medical Services,"theme=primary_care_and_ems; shared_terms=access, medical"
2026182,Investing in Older Adults,health_care_general,new,,,
2026183,Assisting Older Adults to Age in Place,aging_long_term_care,new,,,
2026184,Improving Access to End-of-Life Care,psychiatric_capacity,new,,,
2026185,"Protecting Older Adults from Abuse, Scams, and Fraud",aging_long_term_care,new,,,
2026186,Creating a One-Stop Shop for Benefits for Older New Yorkers,aging_long_term_care,new,,,
2026187,Protecting Immunization Access,health_care_general,continuation,2025163,Expand Access to Dental Care,theme=health_care_general; shared_terms=access
2026188,Improving Vital Records Access,aging_long_term_care,new,,,
2026189,Strengthening Cardiac Emergency Readiness across New York State,health_care_general,new,,,
2026190,Modernizing Pain Management Guidance and Care,opioid_response,new,,,
2026191,Protecting Summer Campers from Extreme Weather Threats,health_care_general,new,,,
2026192,Establishing a Nuclear Reliability Backbone for a Zero-Emission Grid,building_decarbonization,new,,,
2026193,Ensuring New York's Nuclear Power Future is Built By and For New Yorkers,energy_affordability,new,,,
