commitment_id,proposal_title,overlap_theme,continuity_to_prior_year,matched_prior_commitment_id,matched_prior_title,match_basis
2026-160,Promoting Youth Mental Health,mental_health_youth,continuation,2025-152,Support Youth Mental Health in After-School Programs,"theme=mental_health_youth; shared_terms=health, mental, youth"
2026-161,Equipping an Entire Generation with Mental Health First Aid Training,education_general,new,,,
2026-162,Supporting Youth Mental Health for LGBTQ+ New Yorkers,mental_health_youth,continuation,2025-152,Support Youth Mental Health in After-School Programs,"theme=mental_health_youth; shared_terms=health, mental, youth"
2026-163,Expanding Youth Safe Spaces by Designating Two Additional Community Organizations,education_general,new,,,
2026-164,Recognizing Schools Providing Strong Mental Health Supports,education_general,new,,,
2026-165,Hosting a Youth-Led Substance Use Prevention Symposium,education_general,new,,,
2026-166,Ensuring All Child-Serving Clinicians in New York's Office of Mental Health Settings Are Trained in Evidence-Based Practices,mental_health_youth,continuation,2025-152,Support Youth Mental Health in After-School Programs,"theme=mental_health_youth; shared_terms=health, mental"
2026-167,Opening up to 15 New Youth Clubhouses to Support Community-Based Recovery for Young People Suffering from a Substance Use Disorder,education_general,new,,,
2026-168,Establishing a Young Adult Recovery Residence for Individuals Recovering from Opioid Addiction,opioid_response,new,,,
2026-169,Scaling Mental Health Supports for Indigenous Youth,mental_health_insurance,continuation,2025-154,Hold Health Insurance Companies Accountable,theme=mental_health_insurance; shared_terms=health
2026-170,Safeguarding Kids Online,education_general,new,,,
2026-171,Safe By Design: Creating Safer Digital Environments for Kids,mental_health_youth,continuation,2025-016,Take Action to Ensure Distraction-Free Learning,theme=mental_health_youth; shared_terms=
2026-172,Ensuring Fair Play in Online Betting and Limiting Access for Young People,education_general,new,,,
2026-173,Promoting Responsible Digital Citizenship: Supporting Distraction-Free Schools and Student Mental Health,education_general,new,,,
2026-174,Strengthening the Healthcare Delivery System,health_care_general,continuation,2025-168,Strengthen Reporting Requirements for Healthcare Investors,theme=health_care_general; shared_terms=healthcare
2026-175,Expanding the Safety Net Transformation Program,health_care_general,continuation,2025-163,Extend the Safety Net Transformation Program,"theme=health_care_general; shared_terms=net, program, safety, transformation"
2026-176,Expanding the Use of Artificial Intelligence Technology in Healthcare Safely and Equitably,medicaid_coverage,continuation,2025-170,Remove Unnecessary Restrictions on Healthcare Workers,theme=medicaid_coverage; shared_terms=healthcare
2026-177,Strengthening Oversight of Healthcare Transactions,health_care_general,continuation,2025-146,Streamline County Oversight and Enhance Funding,theme=health_care_general; shared_terms=oversight
2026-178,Enabling Transformation of the Healthcare Delivery System,health_care_general,continuation,2025-163,Extend the Safety Net Transformation Program,theme=health_care_general; shared_terms=transformation
2026-179,Empowering the Healthcare Workforce,health_care_general,continuation,2025-168,Strengthen Reporting Requirements for Healthcare Investors,theme=health_care_general; shared_terms=healthcare
2026-180,Removing Unnecessary Restrictions on Healthcare Workers,health_care_general,continuation,2025-168,Strengthen Reporting Requirements for Healthcare Investors,theme=health_care_general; shared_terms=healthcare
2026-181,Reducing Reliance on Temporary Staff to Stabilize the Healthcare Workforce,health_care_general,continuation,2025-168,Strengthen Reporting Requirements for Healthcare Investors,theme=health_care_general; shared_terms=healthcare
2026-182,Expanding Healthcare Access through Workforce Investments,medicaid_coverage,continuation,2025-080,"Leverage Federal Support to Expand Health, Behavioral, and Social Care Workforce",theme=medicaid_coverage; shared_terms=workforce
2026-183,"Improving Healthcare Coverage, Access, and Affordability",health_care_general,continuation,2025-162,Improving the Health of All New Yorkers,theme=health_care_general; shared_terms=improving
2026-184,"Protecting and Expanding Access to Quality, Affordable Health Coverage",medicaid_coverage,continuation,2025-164,Expand Access to Infertility Treatments,theme=medicaid_coverage; shared_terms=access
2026-185,Leveraging New York's Purchasing Power to Drive Down Drug Costs,medicaid_coverage,continuation,2025-009,Expand Lactation Support Services,theme=medicaid_coverage; shared_terms=
2026-186,Reforming Prior Authorizations to Improve Patient Care,public_education_funding,new,,,
2026-187,Increasing Access to Medical Care for Injured Workers,primary_care_and_ems,continuation,2025-166,Ensure Access to Emergency Medical Services,"theme=primary_care_and_ems; shared_terms=access, medical"
2026-188,Investing in Older Adults,health_care_general,new,,,
2026-189,Assisting Older Adults to Age in Place,aging_long_term_care,continuation,2025-104,Provide Starter Home Innovation Funding,theme=aging_long_term_care; shared_terms=
2026-190,Improving Access to End-of-Life Care,psychiatric_capacity,new,,,
2026-191,"Protecting Older Adults from Abuse, Scams, and Fraud",aging_long_term_care,new,,,
2026-192,Creating a One-Stop Shop for Benefits for Older New Yorkers,aging_long_term_care,new,,,
2026-193,Improving Equity in Public Health,health_care_general,continuation,2025-162,Improving the Health of All New Yorkers,"theme=health_care_general; shared_terms=health, improving"
2026-194,Protecting Immunization Access,health_care_general,continuation,2025-167,Expand Access to Dental Care,theme=health_care_general; shared_terms=access
2026-195,Improving Vital Records Access,aging_long_term_care,new,,,
2026-196,Strengthening Cardiac Emergency Readiness across New York State,health_care_general,new,,,
2026-197,Modernizing Pain Management Guidance and Care,opioid_response,new,,,
2026-198,Protecting Summer Campers from Extreme Weather Threats,health_care_general,new,,,
2026-199,Establishing a Nuclear Reliability Backbone for a Zero-Emission Grid,unclear,continuation,2025-056,Promote Opportunity with Electric Readiness for Underdeveloped Properties Fund,theme=unclear; shared_terms=
2026-200,Ensuring New York's Nuclear Power Future is Built By and For New Yorkers,unclear,continuation,2025-056,Promote Opportunity with Electric Readiness for Underdeveloped Properties Fund,theme=unclear; shared_terms=
